company_name,company_category,description,tag_list,founded_at,country,state,region,funding_total_usd,funded_at,funded_year,funded_quarter,cb_url,homepage_url
PressPad,mobile,Mobile publishing platform,"mobile-publishing, mobile, crossplatform, saas, ios, android, desktop",3/1/2011,POL,,Cracow,0,3/1/2011,7/3/1905,2011-Q1,/company/presspad,http://presspadapp.com/en
Snapt,software,Empowering open source solutions,"foss, open-source, opensource, squid, haproxy, frontends, user-interfaces, load-balancing, caching",1/1/2011,ZAF,,Gauteng,0,8/1/2011,7/3/1905,2011-Q3,/company/snapt,http://www.snapt-ui.com
Co3 Systems,software,,"data-breach, incident-response, data-loss, information-security, information-technology",1/1/2010,USA,MA,Boston,0,1/30/2012,7/4/1905,2012-Q1,/company/co3-systems,http://www.co3sys.com
Chikka,mobile,Wireless applications &services provider,"mobile-services, mobile-applications, free-sms, international-sms, mobile-content, wireless-services, instant-messenger, mobile-instant-messenger, im, mobile-email, cmmi-level-5, value-added-services, vas",12/1/1999,PHL,,Pasig,0,9/1/2002,6/24/1905,2002-Q3,/company/chikka,http://www.chikka.com
Setgo,analytics,True cross platform analytics for games,,3/10/2010,GBR,,Liverpool,0,6/5/2012,7/4/1905,2012-Q2,/company/setgo,http://www.pingflux.com
Invoiceable,software,Free Online Invoice Software,"invoice, online, free, software",7/10/2012,GBR,,London,0,7/11/2012,7/4/1905,2012-Q3,/company/invoiceable,http://invoiceable.co
Lanica,games_video,,"mobile, gaming, multiplatform, javascript, crossplatform, titanium, appcelerator, ria, application-development, iphone, android",6/1/2012,USA,CA,SF Bay,0,10/5/2012,7/4/1905,2012-Q4,/company/lanica,http://lanica.co
Flinja,social,Uber for Work,"craigslist, freelancers, services, students, ucla",,USA,CA,SF Bay,0,10/13/2013,7/5/1905,2013-Q4,/company/flinja,http://www.flinja.com
CapRally,software,Freemium Deal Management Application,,10/1/2012,USA,CA,SF Bay,0,10/1/2012,7/4/1905,2012-Q4,/company/caprally,http://www.caprally.com
IDES Technologies,search,Making fraud impossible,,,BEL,,Braine-L'alleud,0,12/1/2011,7/3/1905,2011-Q4,/company/ides-technologies,http://www.ides-technologies.com
LurnQ,education,Open learning/teaching platform ,"social-learning, online-learning, edtech, education",3/22/2011,IND,,Mumbai,0,6/2/2012,7/4/1905,2012-Q2,/company/lurnq,http://lurnq.com
Scoutzie,web,Best web and mobile design.,"mobile, design, winning, iphone, ipad, android, windows, jobs, talent, creative, freelance",1/1/2012,USA,CA,SF Bay,0,8/10/2012,7/4/1905,2012-Q3,/company/scoutzie,https://www.scoutzie.com
SmartShoot,web,Marketplace/Filmmakers & Photographers,"marketplace, crowdsourcing, crowdsource, freelance, video, photo, photography, production, collaborative-consumption",7/1/2012,USA,CA,SF Bay,0,1/20/2011,7/3/1905,2011-Q1,/company/smartshoot,http://www.smartshoot.com
Voxbone,public_relations,,"sip, telephone-numbers, dids, toll-free, sms, fax, inbound-voip-telephony, inum",1/1/2005,BEL,,Brussels,0,10/1/2007,6/29/1905,2007-Q4,/company/voxbone,http://www.voxbone.com
SourceNinja,software,Solving Open Source Headaches,"opensource, security, performance",,,,unknown,0,3/20/2012,7/4/1905,2012-Q1,/company/source-ninja,http://www.sourceninja.com
Veeam Software,software,Solutions for VMware and Hyper-V,"vmware-backup, hyper-v-backup, vsphere-replication, vmware-backup-solutions, vmware-replication, vm-backup, esxi-backup, vmware-backup-software, hyper-v-replication, backup-vmware, virtual-machine-backup, backup-hyper-v, free-vmware-backup, backup-esxi, v",1/1/2006,USA,OH,Columbus,0,7/30/2013,7/5/1905,2013-Q3,/company/veeam-software,http://www.veeam.com
Qraved,hospitality,Pinterest meets Opentable,"social-commerce, restaurants, food",,,,unknown,0,9/5/2013,7/5/1905,2013-Q3,/company/qraved,http://www.qraved.com
Gauss Surgical,biotech,Blood Loss Monitoring Platform,"surgery, mobile, computer-vision, medical, wireless",1/1/2011,USA,CA,SF Bay,0,12/20/2011,7/3/1905,2011-Q4,/company/gauss-surgical,http://www.gausssurgical.com
CloudEngine,mobile,Open source backend for mobile apps,"mobile-backend-as-a-service, mbaas, open-source",6/1/2013,,,unknown,0,9/3/2013,7/5/1905,2013-Q3,/company/cloudengine,http://getcloudengine.net
Pilot Systems,software,,"opensource, oss, plone, zope, python, development, virtualization, xen, hosting, collaborative-work, content-management, intranet, wiki-at-work, trackr, apros-plone",1/1/2000,FRA,,Paris,0,1/1/2007,6/29/1905,2007-Q1,/company/pilot-systems,http://www.pilotsystems.net
Storyz,other,,"viral, social-networking, mobile, cross-platform",1/1/2008,AUS,,Bondi Junction,0,1/1/2007,6/29/1905,2007-Q1,/company/storyz,http://www.storyz.com
Mobclix,mobile,iPhone Ad Exchange Provider,"techcrunch50, tc50, iphone, analytics, free-developer-tools, apple, xcode, interface-designer, shark, instruments, os-x, android, gps, free-real-time-analytics, apple-developer, cocoa, objective-c, 3g, att, edge, free-applications, seedcamp-2008, seedcamp",3/1/2008,USA,CA,SF Bay,0,9/1/2008,6/30/1905,2008-Q3,/company/mobclix,http://www.mobclix.com
Olark,software,Website chat,"chat, support, im, livehelp, free, visitors, jabber, aim, msn, pidgin, adium",4/20/2007,USA,CA,SF Bay,0,6/1/2009,7/1/1905,2009-Q2,/company/olark,http://www.olark.com
Gigalo,enterprise,Mini Services Plattform,"mini-services, 5, freelance, crowdsourcing",2/5/2011,DEU,,Hamburg,0,2/5/2011,7/3/1905,2011-Q1,/company/gigalo,http://www.gigalo.es
Riidr,ecommerce,open platform e-book publishing,"ebook, reading-apps",3/21/2010,DNK,,DNK,0,10/1/2012,7/4/1905,2012-Q4,/company/riidr,http://da.riidr.com
SuperBetter Labs,games_video,Experience Design and Technology Company,"rock-health, health, wellness, social-gaming, social-games, mobile-gaming, concussion, illness, weight-loss",1/1/2011,USA,CA,SF Bay,0,10/1/2012,7/4/1905,2012-Q4,/company/superbetter,http://www.superbetterlabs.com
iSpye,mobile,Social travel application,"travel, student, experience, college, adventure, events, tourism, study, community, holiday, vacation, europe, asia, usa, south-america, accommodation, places, free, international, beach, sea, life",9/26/2012,GBR,,Glasgow,0,9/26/2012,7/4/1905,2012-Q3,/company/ispye,http://www.iSpye.net
Satago,enterprise,Payment behaviour reports,"freelance, small-business, accounting",1/1/2012,GBR,,London,0,1/1/2012,7/4/1905,2012-Q1,/company/satago-net,http://www.satago.co.uk
Reelhouse,games_video,Open Online Video Marketplace,"video, film, web-series, dtc, d2c, marketplace, media, crowdfunding, crowd, funding",9/1/2011,CAN,,Vancouver,0,5/1/2013,7/5/1905,2013-Q2,/company/reelhouse,http://www.reelhouse.org
Pubster,mobile,First App that gives you free drinks,"beer, free, free-beer, loyalty, fidelization, pub, local, geolocalization, app, coins, drinks, deal",3/5/2012,ITA,,Rome,0,2/1/2012,7/4/1905,2012-Q1,/company/pubster,http://www.pubsterapp.com
CoworkingON,other,Flexible Coworking Spaces,"coworking, shared-office, freelancers, startups",,ESP,,Madrid,0,10/10/2013,7/5/1905,2013-Q4,/company/coworkingon,http://www.coworkingon.com
TapZilla,mobile,Mobile application marketing,"paid-mobile-apps-for-free, daily-deals, y-combinator, iphone-applications, app-marketing",10/13/2010,,,unknown,0,8/2/2010,7/2/1905,2010-Q3,/company/tapzilla,http://tapzilla.com
Diaspora,web,Open-Source Distributed Social Network,"open-source, social-network",4/30/2010,USA,CA,SF Bay,0,8/1/2012,7/4/1905,2012-Q3,/company/diaspora,http://joindiaspora.com
LiveStub,ecommerce,Ticket Seller Portal,"tickets, stubhub, free, secondary-ticketing, secondary-ticket-marketplace, morten-lund, transparent, open, fan, sports",,,,unknown,0,1/1/2008,6/30/1905,2008-Q1,/company/livestub,http://www.livestub.com
Academic Earth,education,Free online university courses,"education, video, lectures, academic",1/1/2008,USA,CA,SF Bay,0,10/1/2008,6/30/1905,2008-Q4,/company/academic-earth,http://academicearth.org
Hello! Messenger,messaging,FREE mobile-to-mobile messaging,"instant-messenger, sms, mobile, messages, text, alerts",9/29/2009,USA,SC,Charleston,0,9/29/2009,7/1/1905,2009-Q3,/company/standard-im-inc,http://hellomessenger.com
FreeLunched,advertising,Promotional Platform Giveaway 1 item day,"marketing, free, promotional-platform, consumer-electornics, toys-and-games, daily-giveaway, raffle",1/15/2010,USA,FL,Miami,0,1/15/2010,7/2/1905,2010-Q1,/company/freelunched,http://www.freelunched.com
Stumpwise,enterprise,Free Political Web Platform,,1/1/2010,USA,CA,SF Bay,0,1/1/2010,7/2/1905,2010-Q1,/company/stumpwise,http://get.stumpwise.com
Touchotel,travel,Free iPhone App for Hotel Reservation,,,ITA,,Rome,0,4/26/2012,7/4/1905,2012-Q2,/company/touchotel,http://www.touchotel.com
Geniuzz.com,consulting,Trabajo Online Divertido,"micro-freelance, espaol, spanish, microservices, trabajo-online, online-work, gigs, fiverr",8/1/2010,ESP,,Spain - Other,0,2/1/2012,7/4/1905,2012-Q1,/company/geniuzz-2,http://www.geniuzz.com
NativeX,advertising,Application Network,"app-marketing, native-advertising, mobile-gaming, apps, mobile, free-to-play, freemium, w3i, desktop-applications",5/1/2000,USA,MN,Sartell,0,5/1/2000,6/22/1905,2000-Q2,/company/nativex,http://www.nativeX.com
GFRANQ,photo_video,Instant photo editing service,"photo, photo-editing-online, android, iphone, free-software, start-ups, photo-filters",3/2/2012,GBR,,Tortola British Virgin Islands,0,4/1/2012,7/4/1905,2012-Q2,/company/gfranq,http://gfranq.com
gifted2you,mobile,Social Gifting,"social-gifting, facebook-gifting, gift-cards, free-gift-cards, flowers, chocolates, fine-food, fine-wines",2/1/2012,GBR,,London,0,2/1/2012,7/4/1905,2012-Q1,/company/gifted2you,http://www.gifted2you.com
PenBoutique,ecommerce,An Authorized Pen Dealer.,"montblanc-pens, montblanc-meisterstuck, montblanc-starwalker, waterman-pens, parker-pens, cross-pens, fountain-pens, fine-pens, fisher-space-pens, lamy-pens, filofax",1/1/2004,USA,MD,Washington DC,0,1/1/2004,6/26/1905,2004-Q1,/company/penboutique,http://www.penboutique.com
