company_name,company_category,description,tag_list,founded_at,country,state,region,funding_total_usd,funded_at,funded_year,funded_quarter,cb_url,homepage_url
BenchPrep,education,"Innovative, cross-platform test prep","education, test-prep, gmat, gre, sat, act, lsat, iphone, android, ipad",8/1/2010,USA,IL,Chicago,7800000,7/3/2012,7/4/1905,2012-Q3,/company/benchprep,http://www.benchprep.com
A la Mobile,software,open linux mobile platform,open-source-linux-mobile-platform-hardware-network-mobility-engine,6/1/2005,USA,KS,SF Bay,7550000,3/1/2007,6/29/1905,2007-Q1,/company/a-la-mobile,http://www.a-la-mobile.com
Outright,enterprise,Free online bookkeeping,"bookkeeping, accounting, self-employed, schedule-c, 1099, bookkeeper",6/1/2008,USA,CA,SF Bay,7500000,11/1/2008,6/30/1905,2008-Q4,/company/outright,http://outright.com
OpenLogic,enterprise,Enterprise Open Source Support,,1/1/2005,USA,CO,Denver,7299820,9/27/2006,6/28/1905,2006-Q3,/company/openlogic,http://www.openlogic.com
Appear,software,Mobility. Made Simple.,"context, mobile, middleware, mobile-cloud, cross-platform, app-store, enterprise-mobility, mobile-applications, mobile-web, mobile-strategy, b2b, construction, transportation",9/10/2001,SWE,,Kista,7267800,1/12/2006,6/28/1905,2006-Q1,/company/appear-networks,http://www.appearnetworks.com
yuilop,messaging,Talk free-to-all app,yuilop,12/1/2010,ESP,,Barcelona,7117650,3/22/2011,7/3/1905,2011-Q1,/company/yuilop,http://www.yuilop.com
GENWI,mobile,Cloud Publishing for Mobile,"mcms, mobile-content-management-system, live-and-engaging-apps, cloud-publishing, design-freely, revise-in-real-time, go-mobile-quickly",1/1/2010,USA,CA,SF Bay,7100000,9/23/2010,7/2/1905,2010-Q3,/company/genwi,http://www.genwi.com
Gramble World BV,games_video,Social Entertainment Network,"social-network, social-entertainment, mobile, tablet, smartphone, social-gaming, ios, android, google-play, games, charity, cross-device",5/1/2012,NLD,,Den Haag,7075000,5/23/2012,7/4/1905,2012-Q2,/company/gramble-world,http://www.gramble.com
Grovo,web,"Internet Training, Online Education, New","internet-video, online-education, internet-training, cloud-based-services, internet-training-platform, freemium, online-lms, learning-management-system, social-media, online-video-education, social-media-training, enterprise, enterprise-training",7/1/2010,USA,NY,New York,7023992,7/17/2013,7/5/1905,2013-Q3,/company/grovo,http://www.grovo.com
SourceLabs,enterprise,Open Source Software Tools,"oss, linux, support",,USA,WA,Seattle,7000000,10/1/2006,6/28/1905,2006-Q4,/company/sourcelabs,http://www.sourcelabs.com
Appscio,software,Open source media processing framework,"apps, applications, open-source, avidence",1/1/2006,USA,CA,Freedom,7000000,3/20/2007,6/29/1905,2007-Q1,/company/appscio,http://www.appscio.com
Senova Systems,manufacturing,The future of pH.,"ph-meter, calibration-free, solid-state, ph-scanner, electrode",1/1/2007,USA,CA,SF Bay,6700000,1/12/2012,7/4/1905,2012-Q1,/company/senova-systems,http://www.senovasystems.com
Myxer,music,"Free, Personalized Internet Radio","music, radio, ringtones, downloads, streaming",5/1/2005,USA,TX,Austin,6500000,9/25/2007,6/29/1905,2007-Q3,/company/myxer,http://www.myxer.com
Ebyline,news,Virtual Newsroom Platform,"virtual-newsroom, content-marketplace, newsroom, freelancer, work-flow",8/9/2009,USA,CA,Los Angeles,6500000,11/8/2010,7/2/1905,2010-Q4,/company/ebyline,http://www.ebyline.com
MongoHQ,network_hosting,,"mongodb, nosql, schema-free, schemaless, database, cloud, cloud-hosting",1/1/2011,USA,CA,SF Bay,6417000,6/24/2011,7/3/1905,2011-Q2,/company/mongohq,https://mongohq.com
blinkbox music,music,Music,"music-downloading, streaming, legaldownloading, ad-funded, ad-supported, free-music, drm-free-music",5/7/2007,GBR,,London,6000000,1/1/2008,6/30/1905,2008-Q1,/company/blinkbox-music,http://www.blinkboxmusic.com
Applifier,games_video,Cross-promotion network,"social-games, advertising, cross-promotion, games, facebook",8/1/2008,FIN,,Helsinki,6000000,2/3/2011,7/3/1905,2011-Q1,/company/applifier,http://www.applifier.com
EyeEm,photo_video,Free photo sharing and discovery app,"photo-sharing, android, iphone, photo-discovery, apps, visual-search, smart-albums, recommendations",2/1/2011,DEU,,Berlin,6000000,8/4/2011,7/3/1905,2011-Q3,/company/eyeem,http://www.eyeem.com
Playnomics,mobile,Smarter App UA & Marketing,"ua, mobile, free-to-play-games, app, predictive-analytics, big-data, segmentation",1/1/2009,USA,CA,SF Bay,6000000,2/20/2013,7/5/1905,2013-Q1,/company/playnomics,http://www.playnomics.com
WellnessFX,health,Better Way to Manage Health,active-workplace-athletes-business-cardiovascular-cholesterol-conference-crossfit-crossfit-games-diagnostics-fitness-growth-health-jim-kean-lohas-mental-metabolic-personal-system-biology-psb-quantification-quantified-self-tracking-wellness-wellnessfx-wfx-,4/1/2010,USA,CA,SF Bay,5850000,10/12/2010,7/2/1905,2010-Q4,/company/wellnessfx,http://www.wellnessFX.com
GlassBox,games_video,cross-platform digital broadcast,,,CAN,,Mississauga,5785000,6/10/2008,6/30/1905,2008-Q2,/company/glassbox,http://www.glassbox.tv
Fuse Powered Inc.,mobile,Free Mobile App Publishing Platform,"mobile-analytics, mobile-apps, mobile-reporting, app-publishing, game-publishing, mobile, mobile-games, publishing-platform, fuseboxx, app-configuring, mobile-app-publishing, mobile-game-publishing",6/1/2011,CAN,,Toronto,5600000,5/19/2011,7/3/1905,2011-Q2,/company/fuse-powered,http://www.fusepowered.com
PrestaShop,software,Open Source E-Commerce Software,"ecommerce, e-commerce, software, web, open-source",5/10/2007,FRA,,Paris,5565670,8/1/2011,7/3/1905,2011-Q3,/company/prestashop,http://www.prestashop.com
Popdust,news,,"music, media, popdust, lerer-media-ventures, entertainment, celebrities, gossip, pop-music, pop-culture, gramercy-labs",2/1/2011,USA,NY,New York,5500000,2/3/2011,7/3/1905,2011-Q1,/company/popdust,http://popdust.com
CatchFree,web,Discover best free web-apps,"freeware, sharing",9/1/2010,USA,CA,Los Angeles,5500000,1/6/2011,7/3/1905,2011-Q1,/company/catchfree,http://www.catchfree.com
Scripted,ecommerce,Freelance writing for businesses,"marketplace, freelance, writing, freelance-writing, freelance-services, crowdsourcing",5/1/2011,USA,CA,SF Bay,5500000,11/29/2011,7/3/1905,2011-Q4,/company/scripted,http://www.scripted.com
Aria Networks,software,Network Planning Optimisation Software,"oss, network-planning, operational-support-systems, traffic-forecasting",10/25/2005,GBR,,London,5050000,6/10/2008,6/30/1905,2008-Q2,/company/aria-networks,http://www.aria-networks.com
gBox,web,Music gift-giving service,"gbox, widgets, gifts, drmfree",,USA,CA,SF Bay,5000000,1/1/2008,6/30/1905,2008-Q1,/company/gbox,http://gbox.com
Kashless,ecommerce,Marketplace where everything is free,"reuse, recycle, recommerce, carbon-footprint",9/1/2008,USA,WA,Seattle,5000000,10/29/2008,6/30/1905,2008-Q4,/company/kashless,http://www.kashless.org
One Block Off the Grid (1BOG),cleantech,Home Solar Panel Systems,"home-solar, solar-power, solar-energy, solar-panels, free-solar, solar-energy-systems, solar-panel-systems, solar-power-systems, residential-solar",11/1/2008,USA,CA,SF Bay,5000000,2/11/2010,7/2/1905,2010-Q1,/company/1bog,http://1bog.org
SalesPortal,enterprise,Partnership marketing for contact center,"partnership-marketing, marketing-partnership, partnership-marketing-platform, customer-acquisition-program, cross-brand-collaboration, cloud-based-marketing-solution, cross-selling--upselling, partnership-development, partnership-management, lead-generati",1/1/2009,USA,CA,SF Bay,4935000,7/1/2011,7/3/1905,2011-Q3,/company/salesportal,http://www.salesportal.com
6Wunderkinder,software,"Software Service, SaaS, Productivity","productivity, free, applications, ios, synchronization, cloud, titanium, mac, windows, android, iphone, ipad, collaboration, email, lists, tasks, to-do, multi-platform, simple, web, web-app, app, cross-platform",9/1/2010,DEU,,Berlin,4857750,6/1/2011,7/3/1905,2011-Q2,/company/6wunderkinder,http://www.6wunderkinder.com
Parking Panda,transportation,ITA + OpenTable for the Parking Industry,"parking, transportation, navigation",4/17/2011,USA,MD,Baltimore,4725000,6/6/2011,7/3/1905,2011-Q2,/company/parking-panda,https://www.parkingpanda.com
Busuu,social,Learning Languages Community,"online-language-learning, online-community, social-network, learn-english, learn-spanish, learn-french, learn-german, learning-2-0, education, video-chat, community, free-learning",1/1/2008,ESP,,Madrid,4700000,10/20/2012,7/4/1905,2012-Q4,/company/busuu,http://www.busuu.com
littleBits Electronics,hardware,open source modular electronics,"electronics, prototyping, education, open-source",9/1/2011,USA,NY,New York,4500000,7/18/2012,7/4/1905,2012-Q3,/company/littlebits-electronics,http://littleBits.cc
Rev,other,Services Marketplace for Freelancers,"translation-services, document-translation, translation-agency, certified-translation, transcription",8/1/2010,USA,CA,SF Bay,4500000,3/26/2013,7/5/1905,2013-Q1,/company/rev,http://www.rev.com
Ludei,games_video,We Love HTML5,"games, mobile, html5, ios, android, game-platform, cross-platform",1/1/2009,USA,CA,SF Bay,4500000,6/26/2013,7/5/1905,2013-Q2,/company/ludei,http://www.ludei.com
RethinkDB,enterprise,An open-source distributed database,"mysql, database",5/1/2009,USA,CA,SF Bay,4200000,4/2/2010,7/2/1905,2010-Q2,/company/rethinkdb,http://www.rethinkdb.com
GREE,games_video,"Internet media business,SNS,  free game","mobile-web, japan, tokyo, social-network, mobile-social-network, mobile-games",12/7/2004,JPN,,Tokyo,4197921,7/8/2004,6/26/1905,2004-Q3,/company/gree,http://www.gree-corp.com
drchrono,medical,Bringing iPads to Healthcare,"rock-health, mobile-healthcare, medical-billing, medical-software, free-emr, free-ehr, healthcare, health-care, healthcareit, health-care-it, emr, electronic-medical-records, ehr, electronic-health-records, phr, personal-health-records, physician, doctor",1/1/2009,USA,CA,SF Bay,4125000,7/14/2011,7/3/1905,2011-Q3,/company/drchrono,http://www.drchrono.com
OpenERP,software,Open Source Business Applications,"open-source, erp, free, management, software",1/1/2005,BEL,,Grand-Rosiere,4094700,2/16/2010,7/2/1905,2010-Q1,/company/openerp,http://www.openerp.com
Marketcetera,software,Open Source Automated Trading Platform,,1/1/2006,USA,CA,SF Bay,4000000,6/5/2008,6/30/1905,2008-Q2,/company/marketcetera,http://www.marketcetera.com
nWay,games_video,Game Developer and Publisher,"games, game-developer, video-games, browser-games, free-to-play, chronoblade",1/1/2011,USA,CA,SF Bay,4000000,10/1/2012,7/4/1905,2012-Q4,/company/nway,http://nway.com
UpCity,advertising,Traffic for your site,"seo, search-engine-optimization, seo-software, small-business-seo, seo-report-card, local-seo, smb, social-media-optimization, free-traffic",7/1/2009,USA,IL,Chicago,3500000,1/16/2013,7/5/1905,2013-Q1,/company/diyseo,http://www.UpCity.com
Viewster,games_video,Global Cross-Platform VOD Service,"video-on-deman, vod, video-adverstising, avod, ad-based-vod",1/1/2007,CHE,,Zurich,3500000,10/1/2008,6/30/1905,2008-Q4,/company/viewster,http://www.viewster.com
Rallyhood,social,A free social site,,1/1/2010,USA,,Austin,3500000,8/13/2012,7/4/1905,2012-Q3,/company/rallyhood,http://rallyhood.com
Snapverse,mobile,Free iPhone app,,,,,unknown,3500000,10/29/2013,7/5/1905,2013-Q4,/company/snapverse,http://www.thesnapverse.com
e2e Materials,cleantech,"Cheaper, sustainable, nontoxic biocompos","upstate-ny, biocomposite, formaldehyde-free, sustainability, manufacturing, soy, leed, green-building",1/1/2006,USA,NY,Ithaca,3400000,1/23/2010,7/2/1905,2010-Q1,/company/e2e-materials,http://www.e2ematerials.com
DesignCrowd,design,Design crowdsourcing marketplace,"designcrowd, crowdsourcing, logo-design, web-design, online-design, design-contests, design-marketplace, freelance-design, freelancer, 99design, crowdspring, elance, odesk",1/1/2008,AUS,,Sydney,3300000,11/2/2011,7/3/1905,2011-Q4,/company/designcrowd,http://www.designcrowd.com
Shine Security,security,Free Antivirus for Android ,,1/1/2012,ISR,,Herzliya,3300000,10/1/2012,7/4/1905,2012-Q4,/company/shine-security,http://geshine.com
Whisher,mobile,Free worldwide Wi-Fi,"wi-fi, networks, sharing",3/1/2006,ESP,,Barcelona,3159200,4/1/2006,6/28/1905,2006-Q2,/company/whisher,http://www.whisher.info
twago - teamwork across global offices,consulting,Int'l Online Outsourcing Community,"outsourcing, offshoring, freelancer, project, it, jobs, platform, worldwide, online-outsourcing, community, service-providers, europe, berlin, webdesign, design, translation, project-posting, escrow-payment, directory",3/1/2009,DEU,,Berlin,3140960,6/1/2012,7/4/1905,2012-Q2,/company/twago-teamwork-across-glogal-offices,http://www.twago.com
Gobbler,enterprise,The Open Creative Cloud,"cloud-computing, digital-media, media-content-creation",2/1/2010,USA,CA,Los Angeles,3050000,1/23/2012,7/4/1905,2012-Q1,/company/gobbler,http://www.gobbler.com
G.ho.st,web,free virtual computer,"cloud-computing, ghost-vc, web-os, browser-based, operating-system, cloud",1/1/2006,ISR,,Jerusalem,3000000,5/29/2008,6/30/1905,2008-Q2,/company/g-ho-st,http://g.ho.st
Particle Code,software,Cross-Platform Development Tools,,5/1/2010,USA,CA,SF Bay,3000000,6/30/2010,7/2/1905,2010-Q2,/company/particle-code,http://www.particlecode.com
Ayannah,ecommerce,Cross Border Social Commerce,cross-border-e-commerce-specific-purpose-remittance-send-airtime-electronic-gift-certificates-basic-needs-unbanked,1/1/2008,USA,CA,Los Angeles,3000000,3/1/2013,7/5/1905,2013-Q1,/company/ayannah,http://www.ayannah.com
Depositphotos,web,"Royalty-Free Stock Photo, Video","photo, stock, photography, images, pictures, stock-photos",2/11/2009,USA,FL,Fort Lauderdale,3000000,5/31/2012,7/4/1905,2012-Q2,/company/depositphotos,http://www.depositphotos.com
Brainient,advertising,Cross-device interactive video,"video, video-publishing, video-advertising, video-monetization, video-advertisements, advertising, video-ads, video-management, seedcamp, seedcamp-2009",1/1/2009,GBR,,London,2650000,8/1/2010,7/2/1905,2010-Q3,/company/brainient,http://www.brainient.com
Alter Way,software,open source business process ,,,FRA,,Saint Cloud,2640000,3/12/2007,6/29/1905,2007-Q1,/company/alter-way,http://www.alterway.fr
Cheers,mobile,"the ""like button"" for the real world","mobile, social, love, appreciation, free, app, iphone",9/1/2011,USA,CA,Los Angeles,2500000,3/5/2013,7/5/1905,2013-Q1,/company/cheers,http://chee.rs
UniKey Technologies,mobile,Hands-free home entry,,4/1/2010,USA,FL,Orlando,2350000,5/8/2013,7/5/1905,2013-Q2,/company/unikey-technologies,http://www.unikey.com
mSpot,,Cross platform instant entertainment,,1/1/2004,USA,CA,SF Bay,2330000,8/1/2005,6/27/1905,2005-Q3,/company/mspot,http://www.mspot.com
TheMobileGamer (TMG),games_video,Mobile Social Gaming Company,"mobile-gaming, mobile-entertainment, mobile-applications, freemium, mobile-trial, java-applications, free-java-games, try-before-you-buy, phone-applications, game-applications, iphone-applications, android-applications",1/1/2008,SGP,,Singapore,2300000,1/1/2007,6/29/1905,2007-Q1,/company/the-mobile-gamer,http://tmgamer.co
Synesis,analytics,Open video analytics platform,"video-analytics, onvif, cloud, linux, skolkovo, vsaas, open-source",12/1/2007,RUS,,Moscow,2300000,5/30/2012,7/4/1905,2012-Q2,/company/synesis,http://synesis.ru
StatusNet,software,Open source micro blogging platform,"open-source, creative-commons, microblogging, openmicroblog, laconica, socialnetwork, oembeb, realtime",4/1/2007,CAN,,Montreal,2295000,1/15/2009,7/1/1905,2009-Q1,/company/statusnet,http://status.net
TappIn,enterprise,We connect people to digital content,"online-file-storage, online-file-sharing, photo-sharing, online-file-backup, remote-access, free-file-sharing, top-app, free-online-storage, streaming-videos, streaming-music",1/1/2009,USA,WA,Seattle,2293122,2/23/2011,7/3/1905,2011-Q1,/company/tappin,http://www.tappin.com
Rethink Books,software,Open Ecosystem e-reading platform,books,1/1/2010,USA,TX,Dallas,2250000,11/15/2011,7/3/1905,2011-Q4,/company/rethink-books,http://www.bookshout.com
Evergage,software,Real-time Customer Engagement.,"customer-engagement, in-app-messaging, personalization, customer-analytics, conversion, saas, retention, renewals, churn, free-to-paid, freemium, crm, analytics",9/1/2010,USA,MA,Boston,2250000,5/1/2012,7/4/1905,2012-Q2,/company/evergage,http://www.evergage.com
BookingMarkets (Dashbell),web,OpenTable for Independent Hotels,"hotels, hostels, vacation-rentals, bbs, lodgings, techstars, techstars-boston-fall-2012",7/18/2011,USA,MA,Boston,2222500,1/5/2011,7/3/1905,2011-Q1,/company/bookingmarkets-dashbell,http://dashbell.com
Ushahidi,nonprofit,Crowdsourcing crisis information,"crisis, kenya, africa, information, emergency, disaster, open-source, foss, free",1/9/2008,,,unknown,2095740,8/1/2008,6/30/1905,2008-Q3,/company/ushahidi,http://www.ushahidi.com
Crowd Science,web,Online Market Research,"audience-targeting, audience-segmentation, online-market-research, audience-demographics, online-ad-campaign-effectiveness, free-online-tools, real-time-metrics, brand-advertising-performance, digital-media-metrics",12/1/2007,USA,CA,SF Bay,2000000,12/1/2007,6/29/1905,2007-Q4,/company/crowd-science,http://www.crowdscience.com
Libox,web,HD Media sharing,"media, share, sharing, photo-sharing, file-sharing, sync, hd, p2p, high-definition, peer-to-peer, grid, free",4/15/2008,ISR,,Tel Aviv,2000000,4/23/2008,6/30/1905,2008-Q2,/company/libox,http://www.libox.com
Wibiya,web,Interactive and Custom Web Toolbar,"web-toolbar, web-applications, custom-toolbar, free-toolbar",1/1/2008,,,unknown,2000000,4/20/2010,7/2/1905,2010-Q2,/company/wibiya,http://www.wibiya.conduit.com
AdexLink,advertising,Mobile Apps Platform,"mobile-app-developers, android, ios, mediation, ad-network, cross-promotion, app-marketing, app-monetization",8/16/2010,USA,CA,SF Bay,2000000,6/10/2011,7/3/1905,2011-Q2,/company/adexlink,http://www.adexlink.com
DietBetter,health,Social Motivation for Weight Loss,"social-dieting, weight-loss, gamification, dieting, health, games, online, dietbetting, weight-loss-contests, behavioral-economics, persuasive-technology, captology, behavior-modification",1/1/2011,USA,NY,New York,1900000,5/1/2013,7/5/1905,2013-Q2,/company/dietbetter,http://www.dietbetter.com
Brandcast,web,Cross-Channel Web Management,,1/1/2012,USA,CA,SF Bay,1800000,1/1/2013,7/5/1905,2013-Q1,/company/brandcast,https://brandcast.com
Ribbon,ecommerce,Selling across the web.,"e-commerce, payments, mobile-commerce, social-commerce, angelpad",7/1/2012,USA,CA,SF Bay,1750000,9/1/2011,7/3/1905,2011-Q3,/company/ribbon,https://www.ribbon.co
Pricing Engine,advertising,Simply Improving Digital Advertising.,"advertising, digital-media, adwords, saas, big-data, analytics, freemium, smb, subscription, adtech",6/6/2011,USA,NY,New York,1725000,1/1/2012,7/4/1905,2012-Q1,/company/pricing-engine,http://www.pricingengine.com
Diagnosia,search,Online Drug Search,"ehealth, medication, doctor, information, drug, patient, medical, database, leaflet, premium, pharmaceuticals, remedy, search, online, free",2/1/2011,AUT,,Vienna,1700000,10/9/2013,7/5/1905,2013-Q4,/company/diagnosia,http://www.diagnosia.com
iversity,education,The European Open Course Platform,"research, education, elearning, esience, web-2-0, academics",7/14/2011,DEU,,TBD,1699790,1/16/2013,7/5/1905,2013-Q1,/company/iversity,http://iversity.org
BeFunky,photo_video,Photo Editing Tools for Web and Mobile ,"photo-editing, photo-effects, photo-sharing, photo, mobile, iphone, free, edit-photos, picture-editor",1/1/2007,USA,,United States - Other,1650000,6/2/2008,6/30/1905,2008-Q2,/company/befunky,http://www.befunky.com
MBA and Company,consulting,Freelance Marketplace,"talent-brokerage, projects, mba, consultancy, strategy, research, marketplace, freelance, recruitment, network",7/1/2009,GBR,,London,1611780,10/1/2010,7/2/1905,2010-Q4,/company/mba-and-company,http://www.mbaco.com
Bababoo,messaging,Free and low cost Internet calling,"mobile, voip, iphone, free-internet-calling",2/1/2010,USA,,United States - Other,1500000,5/10/2011,7/3/1905,2011-Q2,/company/bababoo-intelligent-calling-service,http://www.bababoo.com
Spree Commerce,ecommerce,Flexible Open Source E-Commerce,"ecommerce, rails, opensource",7/1/2011,USA,MD,Washington DC,1500000,10/10/2011,7/3/1905,2011-Q4,/company/spree-commerce,http://spreecommerce.com
"deets, Inc.",mobile,Mobile Technology Communication Platform,"social-networking, social-organization, contact-management, profiles, personas, mobile-communication, crossover-communication, organize-your-life, organize-your-networks, relationship-management, mobile-networking, show-me-yours, details, contact-informat",2/8/2011,USA,CT,Westport,1500000,11/25/2012,7/4/1905,2012-Q4,/company/deets,http://www.sharedeets.com
BlueKite,web,"cross-border bill payments, remittances",,1/1/2012,USA,FL,Miami,1500000,1/9/2013,7/5/1905,2013-Q1,/company/bluekite,http://www.bluekite.com
AdStage,advertising,Cross-Network Advertising Platform,"ppc, advertising, social, search, machine-learning, enterprise, software, internet, adwords, social-media, marketing",5/1/2012,USA,CA,SF Bay,1500000,3/1/2013,7/5/1905,2013-Q1,/company/adstage,https://www.adstage.io
Adbrain,,,"multi-screen, audience-attribution, data-driven, advertising, cross-device, mobile, rtb",,GBR,,London,1500000,7/15/2013,7/5/1905,2013-Q3,/company/adbrain,
Tracky,software,open social collaboration platform,,11/5/2010,USA,NV,Las Vegas,1500000,6/13/2012,7/4/1905,2012-Q2,/company/tracky,https://tracky.com
Samba Mobile,mobile,free internet,"tablet, internet, video-marketing, value-exchange",5/9/2010,GBR,,London,1429000,11/1/2011,7/3/1905,2011-Q4,/company/samba-mobile,http://www.sambamobile.com
Youboox,web,The free access to ebooks,"ebooks, free-ebooks, freemium-model, stream-books-free, innovative-model",1/1/2011,FRA,,Paris,1415260,9/24/2013,7/5/1905,2013-Q3,/company/youboox,http://www.youboox.fr
AudioMicro,games_video,Content Licensing Network,"music, audio, royalty-free-music, production-music, music-cues, catalog, artists, license, songs, independent, , license-music, buyout-music, commercial-music, sound-effects, stock-music, content-licensing, free-sound-effects, micro-stock, music-licensing",5/24/2008,USA,CA,Los Angeles,1250000,2/1/2011,7/3/1905,2011-Q1,/company/audiomicro,http://www.audiomicroinc.com
Embarke,web,Email Engagement ,"developer, api, social, networks, communication, conversation, cross-network, cross-platform, one-api",4/29/2011,USA,CA,San Diego,1250000,10/14/2013,7/5/1905,2013-Q4,/company/embarke,http://www.embarke.com
Crunch Accounting,web,Love Accounting,"online-accounting, accounting, finance, freelancers, contractors, tax",6/16/2008,GBR,,Hove,1219418,9/12/2009,7/1/1905,2009-Q3,/company/crunch,http://www.crunch.co.uk
Junar,enterprise,Open Data Platform Provider,"big-data, data-sets, open-data, open-gov, open-government, data-gov",1/1/2010,USA,CA,SF Bay,1200000,5/29/2012,7/4/1905,2012-Q2,/company/junar,http://www.junar.com
Whistle.co.uk,government,Making politics open,"politics, activism, community, government, causes, charity, polls, campaign",7/15/2009,GBR,,London,1200000,4/1/2010,7/2/1905,2010-Q2,/company/whistle-co-uk,http://www.whistle.co.uk
SCIC SA Adullact Projet,software,evelops and installs free software,,,FRA,,Montpellier,1190000,10/20/2009,7/1/1905,2009-Q4,/company/scic-sa-adullact-projet,http://www.adullact-projet.coop
Bountysource,web,Funding platform for open-source,"bounties, open-source, fundraiser, issue, crowd-funding",8/22/2012,USA,CA,SF Bay,1100000,7/17/2013,7/5/1905,2013-Q3,/company/bountysource,https://www.bountysource.com
CalmSea,analytics,Next-gen Predictive Analytics Platform,"social-data, analytics, big-data, customer-segmentation, social-customer-analytics, unstructured-data, cross-channel-communication",1/1/2009,USA,CA,SF Bay,1100000,7/23/2012,7/4/1905,2012-Q3,/company/calmsea,http://www.calmseainc.com
Infindo Technology Sdn Bhd,mobile,All about mobile experience,"appstore, apps, cross-platform, app-creator, application, app-store",1/1/2007,MYS,,Petaling Jaya,1100000,4/1/2011,7/3/1905,2011-Q2,/company/infindo-technology-sdn-bhd,http://www.infindo.com
SeamlessDocs (bizodo),enterprise,Convert Docs to Cloud Docs,"online-form-builder, free-online-form-builder, build-online-forms, project-management-software, shared-contact-manager, drag-and-drop-form-builder",7/15/2011,USA,NY,New York,1085000,6/4/2012,7/4/1905,2012-Q2,/company/bizodo,http://www.SeamlessDocs.com
Dashbell,travel,OpenTable for Independent Hotels,"travel, hotel, software, saas, hotel-software, boston, techstars",10/1/2012,USA,MA,Boston,1053000,6/1/2013,7/5/1905,2013-Q2,/company/dashbell,http://dashbell.com
ShiftPlanning,software,Online Employee scheduling,"free-online-employee-scheduling, online-employee-scheduler, employee-schedule-management, workforce-management",2/10/2010,USA,CA,SF Bay,1050000,8/7/2012,7/4/1905,2012-Q3,/company/shiftplanning,http://www.shiftplanning.com
"Monoco, Inc.",ecommerce,Cross-border Social Marketplace,"ecommerce, marketplace, social-commerce",5/10/2010,JPN,,Tokyo,1045000,8/26/2010,7/2/1905,2010-Q3,/company/monoco-inc,http://monoco.jp
DoNanza,web,Freelance jobs search and tools,"freelance, search, freelance-jobs, freelance-tools, online-project, jobsearch, job-board, writers, designers, developers",8/1/2008,ISR,,Tel Aviv,1000000,6/28/2011,7/3/1905,2011-Q2,/company/donanza,http://www.donanza.com
Minus,web,Minus - Share Simply.,"hosting, sharing, image-sharing, file-sharing, url-shortening, free-service, free",10/1/2010,USA,NY,New York,1000000,8/2/2011,7/3/1905,2011-Q3,/company/minus,http://minus.com
PhotoMania,games_video,Free Social Photo Editor,"photo-editing, sharing, art, effects, facebook, photos",2/1/2011,ISR,,Ramat Gan,1000000,12/1/2011,7/3/1905,2011-Q4,/company/photomania,http://www.photomania.net
