company_name,company_category,description,tag_list,founded_at,country,state,region,funding_total_usd,funded_at,funded_year,funded_quarter,cb_url,homepage_url
Trigger,mobile,"Cross-platform apps, made simple",,1/1/2011,USA,CA,SF Bay,1000000,1/17/2012,7/4/1905,2012-Q1,/company/triggerio-2,http://trigger.io
OrangeScape,enterprise,Visual PaaS - Cloud Application Platform,"cloud, paas, platform-as-a-service, cross-cloud, visual-cloud",12/1/2003,IND,,Chennai,1000000,5/1/2012,7/4/1905,2012-Q2,/company/orangescape,http://www.OrangeScape.com
Qustodio,software,free parental control,"parental-control, internet-monitoring, kids-protection, cyberbullying, security",1/1/2011,ESP,,Barcelona,1000000,3/5/2013,7/5/1905,2013-Q1,/company/qustodio,http://www.qustodio.com
Joyride App,mobile,In-Car Entertainment,"mobile-apps, automotive, car, voice, hands-free, entertainment, games",1/1/2012,USA,CA,SF Bay,1000000,3/25/2013,7/5/1905,2013-Q1,/company/joyride-app,http://getjoyride.com
Ninja Blocks,hardware,Open Source IoTs,"internet-of-things, iot, open-source, open-source-hardware, open-source-software, api",1/1/2012,AUS,,Eveleigh,1000000,7/1/2013,7/5/1905,2013-Q3,/company/ninja-blocks,http://ninjablocks.com
"SimplePons, Inc.",web,Couponless Renuable APP,"daily-deals, coupon, buy-one-get-one-free, 50-off",2/1/2011,USA,FL,Palm Beach,1000000,11/1/2011,7/3/1905,2011-Q4,/company/simplepons,http://www.simplepons.com
creditmontoring.com,finance,Credit Monitoring,"credit-monitoring, credit-scores, free-credit-score, free-credit-scores",9/15/2011,USA,AZ,Phoenix,1000000,8/2/2012,7/4/1905,2012-Q3,/company/creditmontoring-com,http://www.creditmonitoring.com
Desmos,software,,"education, education-tool, math-software, ed-tech, edtech, education-technology, math-technology, graphing-calculator, online-graphing-calculator, free-online-graphing-calculator, cross-platform, interactive-education",1/1/2011,USA,CA,SF Bay,900000,8/5/2011,7/3/1905,2011-Q3,/company/desmos,http://desmos.com
LegalGuru,legal,Free Professional Information Portal,free-information-portal-video-centric-legal-professional-helpful,3/31/2011,USA,FL,Miami,900000,3/31/2011,7/3/1905,2011-Q1,/company/legalguru,http://www.legalguru.com
Fibroblast,enterprise,SaaS for Connecting Doctors and Patients,"patient-scheduling, medical, doctors, cross-referrals, patient-referrals, appointment-scheduling, excelerate-labs, excelerate-labs-2012",1/1/2010,USA,IL,Chicago,875000,6/1/2012,7/4/1905,2012-Q2,/company/fibroblast,http://www.fibroblast.com
Kabooza,software,free backup software,"backup, online-backup--online-storage, backup-service",1/1/2007,,,unknown,868000,2/3/2009,7/1/1905,2009-Q1,/company/kabooza,http://www.kabooza.com
Unbooked Ltd,web,We list and sell open appointments,"online-appointments, services, sales, home, health, beauty, business, enterprise",1/1/2010,USA,CA,SF Bay,850000,2/1/2011,7/3/1905,2011-Q1,/company/unbooked-ltd,http://www.unbooked.com
ShowMe,education,Open learning community,"education, ipad, digtal-learning, learning",8/1/2009,USA,NY,New York,840000,5/1/2010,7/2/1905,2010-Q2,/company/showme,http://showme.com
Geoli.st Classifieds,mobile,Mobile classifieds social network,"mobile-social-networking, mobile-classified-ads, mobile-classified-jobs, mobile-classified-personals, mobile-dating, mobile-help-wanted, mobile-ads, mobile-classifieds, mobile-social-network, mobile-personals, free-classifieds, post-free-ads, free-classif",1/3/2010,,,unknown,800000,1/3/2010,7/2/1905,2010-Q1,/company/geoli-st,http://geoli.st
MyJobMatcher.com,web,Free to use universal job watchdog,jobs-jobsearch-job-matching-universal-job-watchdog-job-seeker-job-aggregation-matching-jobs,11/11/2011,GBR,,London,720000,12/1/2012,7/4/1905,2012-Q4,/company/myjobmatcher-com,http://myjobmatcher.com
ZupCat,games_video,Cross-platform free-to-play games,"social-games, zupcat, latin-america, race-town, car-games, mobile, facebook, unity, unity3d, multyiplayer, asynchronous",1/1/2010,ARG,,Buenos Aires,700000,9/1/2011,7/3/1905,2011-Q3,/company/zupcat,http://www.zupcat.com
Teamer.net,sports,Online Sports Social Platform,"sports-social-network, group-communications-platform, sms, sports-team-management, freemium, text-messaging",9/1/2008,IRL,,Mount Merrion,682850,3/11/2010,7/2/1905,2010-Q1,/company/teamer,http://www.teamer.net
Deskwanted,search,Find & manage coworking spaces,"coworking, coworking-space, collaborative-workspaces, creative-industry, shared-office, offices, community, network, freelancer, independent-workers, management-tool, booking-system, search-engine",12/1/2009,DEU,,Berlin,681350,11/1/2011,7/3/1905,2011-Q4,/company/deskwanted,http://www.deskwanted.com
Puzl,search,Free business website builder,"website-builder, freemium, business-software, saas, drag-and-drop",2/15/2011,GBR,,Stockport,680000,12/15/2010,7/2/1905,2010-Q4,/company/puzl,http://puzl.com
Prediki Prediction Services,other,The open prediction plattform,"market-research, collective-intelligence, predictions, analyses, forecasting, forecast, enterprise-2-0",,,,unknown,650000,12/2/2012,7/4/1905,2012-Q4,/company/prediki-prediction-services,
Epic Playground,analytics,Real-time Media Analytics,"audio, video, analytics, engagement, cross-device, cross-player, techstars, techstars-cloud-2012",1/30/2009,USA,CO,Denver,585000,12/1/2011,7/3/1905,2011-Q4,/company/epic-playground,http://epicplayground.com
Zoodak,finance,"Fantasy stock trading, social networking","stock-trading-social-network, virtual-stock-market-game, free-investment-game-simulation, online-stock-exchange-game, fantasy-stock-market-trading, stock-historical-market-tips",4/1/2008,USA,CA,SF Bay,580000,8/1/2009,7/1/1905,2009-Q3,/company/zoodak,http://zoodak.com
Bulu Box,ecommerce,Birchbox.com for Vitamins & Supplements,"ecommerce, discovery, box, sample, nebraska, vitamin, supplement, subscription, birchbox, weight-loss, health, fitness, nutrition, healthy-living, lifestyle",4/17/2012,USA,NE,Omaha,550000,9/5/2012,7/4/1905,2012-Q3,/company/bulu-box,http://www.BuluBox.com
Hamstersoft,software,HamsterSoft was founded in 2010 and is f,"video-editing, dvd-burning, zip, unzip, software, free, download",1/1/2010,,,unknown,500000,1/1/2013,7/5/1905,2013-Q1,/company/hamstersoft,http://www.Hamstersoft.com
Kneebone,software,Cross Marketing Performance Technology,"marketing-performance-management, cross-marketing-analytics, marketing-planning, marketing-forecasting, marketing-roi, analytics-software, marketing-intelligence, event-based-marketing",1/1/2004,CAN,,Toronto,482000,1/5/2010,7/2/1905,2010-Q1,/company/kneebone,http://www.kneebone.com
3DVista,software,Free professional virtual tour service,,,,,unknown,475000,6/3/2008,6/30/1905,2008-Q2,/company/3dvista,http://www.3dvista.com
Polantis,hardware,3D Catalog Technology,"3d-objects, 2d-symbols, cad-objects, free-3d-cad-objects, autocad-objects, free-cad-library, free-cad-blocks, cad-for-architects",8/1/2008,FRA,,Le Pecq,457912,4/1/2010,7/2/1905,2010-Q2,/company/polantis,http://www.polantis.com
Blueseed,travel,Visa-free startup community,"startup, community, incubator, accelerator, ship, ocean, startup-hosting, jurisdictional-arbitrage, visa-free, startup-visa, visa, innovation, international-waters, seasteading",7/31/2011,USA,CA,SF Bay,450000,12/13/2012,7/4/1905,2012-Q4,/company/blueseed,http://blueseed.com
nubelo,web,Freelance services marketplace,"freelance-services, online-work, job-platform, spain, latin-america, telecommuting",11/1/2011,ESP,,Barcelona,416102,7/1/2012,7/4/1905,2012-Q3,/company/nubelo,http://www.nubelo.com
Seventh Continent,other,"24/7self regulated, free market","e-commerce, virtual-market, virtual-money, virtual-currency, virtual-world, business, companies, stock",6/17/2007,,,unknown,400000,7/1/2009,7/1/1905,2009-Q3,/company/seventh-continent,http://www.gameontheseventhcontinent.com
Imonomy Interactive,software,Free Pictures For Websites,"free-pictures, free-images, pictures-for-websites, monetization",1/1/2012,ISR,,Ramat Gan,400000,5/23/2013,7/5/1905,2013-Q2,/company/imonomy-interactive,http://imonomy.com
Someecards,web,Free online greeting cards,"cards, ecards, funny, humor",4/1/2007,USA,NY,New York,350000,4/1/2008,6/30/1905,2008-Q2,/company/someecards,http://someecards.com
Tushky,other,Monetize Free Time,"leisure, entertainment, events, activities, things-to-do, travel, destination-services",9/1/2011,IND,,Mumbai,340000,9/2/2013,7/5/1905,2013-Q3,/company/tushky,http://Tushky.com
OpenSearchServer,enterprise,Open Source Search Engine,"search, enterprise, full-text, fulltext, index, lucene, france, categorization",1/1/2010,FRA,,Paris,300000,7/1/2011,7/3/1905,2011-Q3,/company/opensearchserver,http://www.open-search-server.com
Sendmebox,ecommerce,Service of cross-border purchases,,2/4/2013,,,unknown,300000,4/5/2013,7/5/1905,2013-Q2,/company/sendmebox-ru,http://sendmebox.com
Aeria Games & Entertainment,games_video,"Free to Play PC, Brows and Mobile Games","mmorpg, gaming, casualgames, socialnetworking",8/2/2006,USA,CA,SF Bay,288000,10/1/2007,6/29/1905,2007-Q4,/company/aeria,http://www.aeriagames.com
studdex,web,Solution for Intntl Student Recruitment,"study-aborad, university, universities, student, summer-school, degree, free-mover, exchange",5/1/2008,DEU,,Berlin,279720,5/1/2008,6/30/1905,2008-Q2,/company/studdex,http://www.studdex.com
EmergentDetection,hardware,Fitness Technology,"keegan-hall, eric-fogel, bodykey, university-of-washington, fitness, technology, weight-loss",4/1/2010,,,unknown,277900,1/1/2010,7/2/1905,2010-Q1,/company/emergentdetection,http://www.EmergentDetection.com
dbTwang,web,Guitar social network,web2ireland-guitar-collectable-ireland-irish-freemium-recurring-subscription,1/1/2008,,,unknown,267436,12/19/2008,6/30/1905,2008-Q4,/company/dbtwang,http://www.dbtwang.com
Tunepresto,games_video,music maker,"web2ireland, music, royalty-free-music, music-composer, compose, soundtrack, video-driven, audio-composer, audio-software, video-editing",1/1/2008,IRL,,Galway,263400,1/1/2007,6/29/1905,2007-Q1,/company/abaltat,http://www.tunepresto.com
Quosis,software,open source software service,,1/1/2004,FIN,,Jyvaskyla,260000,1/9/2007,6/29/1905,2007-Q1,/company/quosis,http://www.quosis.com
Socialspiel,games_video,"social games, online","social, games, online, socialgames, free-to-play, startup, puzzle, ex-rockstar, browser, vienna, austria",5/22/2010,AUT,,Vienna,257320,8/20/2013,7/5/1905,2013-Q3,/company/socialspiel,http://socialspiel.com
LilaKutu,web,Personalized Beauty Discovery,"ecommerce, beauty, cosmetics, birchbox, glossybox, joliebox, subscription-based, turkey",3/1/2011,TUR,,Istanbul,250000,7/31/2013,7/5/1905,2013-Q3,/company/lilakutu,http://lilakutu.com
Ofuz,software,small business productivity,"invoice, freelance, small-business, task-management, collaboration, project-management",1/1/2010,USA,CA,Los Angeles,250000,2/1/2009,7/1/1905,2009-Q1,/company/ofuz,http://ofuz.com
Colectica,software,Open Standards Data Documentation,"open-standards, data, statistics",1/1/2010,USA,MN,Minneapolis,250000,9/30/2006,6/28/1905,2006-Q3,/company/colectica,http://www.colectica.com
Homeforswap,travel,Home swap service,"home-exchange, budget-travel, free-accommodation, home-swap, eco-travel",1/1/2009,ESP,OH,unknown,250000,1/1/2011,7/3/1905,2011-Q1,/company/homeforswap,http://www.homeforswap.com
mobifriends,web,meet new people for free,"mobifriends, free, social-network, dating, friendship, internet, mobile, chat, videomessenger",10/25/2005,ESP,,Barcelona,205862,1/1/2006,6/28/1905,2006-Q1,/company/mobifriends,http://www.mobifriends.com
Artsly,education,Artsly lets you discover free video less,"art, craft, education, online-learning",6/1/2013,,,unknown,175000,1/1/2012,7/4/1905,2012-Q1,/company/artsly,http://artsly.co
Polisofia,enterprise,Open Innovation as a Service,"crowdsourcing, open-innovation, crowd-sourcing, innovation, challenges",9/1/2011,ARG,,Buenos Aires,170000,10/31/2011,7/3/1905,2011-Q4,/company/polisofia,http://www.polisofia.com
The Float Yard,software,Float - Real time Financial Forecasting,"finance, accounting, cash, cashflow, forecasting, spreadsheets, projections, freeagent, xero",10/7/2010,GBR,,Edinburgh,166678,9/11/2013,7/5/1905,2013-Q3,/company/the-float-yard,http://www.floatapp.com
Simple Lifeforms,games_video,On-line Games ,"dublin, ireland, social-games, games, online-games, free-games, casual-games, mmo, mmorpg, publisher",6/18/2008,IRL,,Dublin,155048,12/19/2008,6/30/1905,2008-Q4,/company/simple-lifeforms,http://www.simplelifeforms.com
youblisher.com,public_relations,Create page flipping pdfs,"catalogs, catalogues, brochures, search, catalog-promotion, pdf-download, catalogue-search, pdf-catalogs, flippable-pdfs, page-flip-effect, publication-network, hosted-service, web-2-0, issuu, scribd, yudu, pdf, publisher, youblisher, free, saas, software",11/19/2008,CHE,,Herisau,150000,11/19/2008,6/30/1905,2008-Q4,/company/youblisher-com,http://www.youblisher.com
Workers On Call,consulting,Outsourced Worker site,"odesk, elance, freelancer, outsource, freelance, work, work-site",1/2/2013,USA,HI,Pahoa,150000,1/2/2013,7/5/1905,2013-Q1,/company/workers-on-call,https://www.workersoncall.com
Greenbird Integration Technology,software,Open Integration Technology,"soa, ami, amr, amm, integration, open-source, smart-meter, smart-metering, smart-grid, smart-integration, middleware, bpm, jee, esb, bpe",1/1/2010,NOR,,Oslo,144060,1/1/2010,7/2/1905,2010-Q1,/company/greenbird-integration-technology,http://www.greenbird.com
Widgetlabs,public_relations,The App Agency,"widget, apps, agency, mobile, cross-platform, ecosystem, widgets, app, app-store, social-media-marketing, social-media, widget-campaign, development, conception, seeding, facebook, myspace",5/1/2007,DEU,,Cologne,131700,1/1/2007,6/29/1905,2007-Q1,/company/widgetlabs,http://widgetlabs.eu
ONDiGO CRM,mobile,Mobile CRM for micro-businesses,"mobile, crm, micro-businesses, contact-management, networking, business-contact-management, customer-management, lead-management, small-business, android, apps, free-app",3/1/2012,USA,CA,SF Bay,120000,1/1/2013,7/5/1905,2013-Q1,/company/ondigo,http://ondigo.me
Ziptask,consulting,Fully Managed Outsourcing,"crowd-labor, outsourcing, managed-outsourcing, online-labor, online-work, freelancing, virtual-work, virtual-project-management, techstars, techstars-cloud-2013",11/1/2011,USA,CA,Los Angeles,118000,1/14/2013,7/5/1905,2013-Q1,/company/ziptask,http://www.ziptask.com
TradingView,web,Trading ideas on infographics,"free, online, stock, charts, forex, fx, invest, community, public, social, network, trade, market, financial, business, cloud, ipad, iphone, android, html, tool, finance, learning, techstars, techstars-chicago-2013",9/1/2011,USA,IL,Chicago,118000,5/1/2013,7/5/1905,2013-Q2,/company/tradingview,http://tradingview.com
Deline.JY Inc.,web,,"sms, texting, sns, mobile, web, korea, intend, bre, technology, santel, snaptoc, asia, snapster, free-sms",10/1/2008,KOR,,Seoul,100000,10/7/2008,6/30/1905,2008-Q4,/company/deline-jy-inc,http://www.delinejy.com
Birthday Slam,health,Free stuff and more on your birthday,"deals, marketing, demographics, advertising, b2b, free, offeres",10/1/2010,CAN,,Toronto,100000,10/1/2010,7/2/1905,2010-Q4,/company/birthdayslam-com,http://www.birthdayslam.com
Gigzon,ecommerce,Buy and Sell Services online,"micro-work, freelancing",12/1/2011,,,unknown,100000,3/1/2012,7/4/1905,2012-Q1,/company/gigzon,http://www.gigzon.com
DateMyFamily.com,social,Family Oriented Dating Site,"free-online-dating, online-dating-sites, family-oriented-dating-website, social-networking",11/11/2011,USA,FL,Fort Lauderdale,100000,12/1/2011,7/3/1905,2011-Q4,/company/datemyfamily-com,http://www.datemyfamily.com
Edicy,other,Create a website,"create-free-website, editor, small-business-website, web-hosting, web-design, web-development, simple-web-editing, wysiwyg, free-blog, free-website, free-webpage, how-to-make-a-website, web-address, easy-to-use, build-a-website",11/1/2007,EST,,Tartu,100000,2/1/2008,6/30/1905,2008-Q1,/company/edicy,http://www.edicy.com
PLAXD,games_video,Data-mining game developer,"data-mining, mobile-gaming, games, free-to-play, machine-learning, analytics, social-games, data-analytics, hidden-objects-games",5/1/2012,,,unknown,100000,5/1/2012,7/4/1905,2012-Q2,/company/plaxd,http://www.plaxd.com
Madvenue,web,design and development marketplace,"marketplace, logo-design, web-design, online-design, design-contests, design-marketplace, freelance-design, freelancer, 99design, crowdspring, elance, odesk",11/1/2011,,,unknown,67460,12/1/2011,7/3/1905,2011-Q4,/company/madvenue,http://www.madvenue.com
Browserling,software,Interactive Cross-Browser Testing,testing-stackvm-developer-tool,3/11/2011,USA,CA,SF Bay,55000,3/1/2011,7/3/1905,2011-Q1,/company/browserling,http://browserling.com
ShutterCal,web,Calendar based daily photo journal,"photo, photography, social, calendar, print, community, project, project365, postcard, canvas, membership, freemium, service, print-service, services, website, products, made-in-the-usa",5/7/2007,,,unknown,52000,2/1/2013,7/5/1905,2013-Q1,/company/shuttercal,http://www.ShutterCal.com
Science Behind Sweat,analytics,Personalized fitness/health roadmaps,"big-data, fitness, analytics, machine-learning, crossfit",3/1/2011,USA,,Portland,50000,3/19/2012,7/4/1905,2012-Q1,/company/science-behind-sweat,http://sciencebehindsweat.com
Talenz,web,Connecting students with industry,"student-industry, freelance-student-work, part-time-work, student-projects, company-outsourcing, freelance-research, knowledge-sharing, azione-capital",1/1/2008,SGP,,Singapore - Other,50000,1/1/2007,6/29/1905,2007-Q1,/company/talenz,http://www.talenz.com
Binpress,software,Marketplace for commercial open-source,"open-source, marketplace, developers, development, appstore, web, mobile",8/7/2010,USA,CA,SF Bay,50000,4/15/2013,7/5/1905,2013-Q2,/company/binpress,http://www.binpress.com
School Admissions,education,Tension-Free School Admissions ,"k12, school, education, research, saas, pre-school, india, nursery",4/17/2012,IND,,New Delhi,50000,4/15/2013,7/5/1905,2013-Q2,/company/school-admissions,http://www.schooladmissions.in
SoFits.Me,fashion,Your personal imagemaker - online & free,"fashion, style, stylist, consultancy, shopping, online-shopping",2/1/2012,,,unknown,50000,6/1/2013,7/5/1905,2013-Q2,/company/sofits-me,http://sofits.me
RapaZapp interactive studios,games_video,social development services,"startup, cross, platform, development, social, media, outsourcing, game, engine, network, chile, latinamerica",9/1/2011,DEU,,Regensburg,40000,12/1/2011,7/3/1905,2011-Q4,/company/rapazapp-interactive-studios,http://www.rapazapp.com
ClosetDash,ecommerce,Shop and Swap the Fashions You Love!,"ecommerce, recommerce, social-netowrking, sell, swap, free",9/15/2012,USA,NY,New York,40000,6/3/2013,7/5/1905,2013-Q2,/company/closetdash,http://www.closetdashshop.com
Edhub,education,Open the K12 industry for software devel,"education-technology, education, teacher-tools",3/1/2013,,,unknown,38598,9/1/2013,7/5/1905,2013-Q3,/company/edhub,http://www.edhub.io
easy2map,software,Online Mapping Solutions,"free, google-maps, mapping-tool, map-builder, maps, custom, embed, easy, no-coding, freemium",6/1/2011,ZAF,,Cape Town,36000,2/1/2013,7/5/1905,2013-Q1,/company/easy2map,http://www.easy2map.com
ExpertFlyer,search,,"airline-schedule, frequent-flyer, airline-availability, seat-map, free-award-travel, airline-upgrades, airfare, travel, travel-search, new-york",3/5/2004,USA,NY,Patchogue,30000,3/1/2004,6/26/1905,2004-Q1,/company/expertflyer,http://www.ExpertFlyer.com
IonLogix Systems,software,,"voice-over-ip, voip, technology-startup, asterisk, freevoiceline, free-long-distance",12/11/2007,USA,TX,Austin,30000,10/24/2008,6/30/1905,2008-Q4,/company/ionlogix-systems,http://www.ionlogix.com
HexAirbot,,Professional open source UAV developer,,,,,unknown,25000,1/1/2013,7/5/1905,2013-Q1,/company/hexairbot,http://hexairbot.com
CitalDoc,medical,Free Medical appointments online.,nxtplabs,1/1/2011,,,unknown,25000,1/8/2012,7/4/1905,2012-Q1,/company/citaldoc,http://citaldoc.com
GameBuilder Studio,games_video,Create Once Play Everywhere,"games, cross-platform, mobile, gaming",12/7/2010,USA,CA,SF Bay,22500,4/6/2011,7/3/1905,2011-Q2,/company/gamebuilder-studio,http://gamebuilderstudio.com
Smackages,ecommerce,Your Makeup Counter--Now Online,"makeup, recommendation-engine-beauty-freemium",6/10/2010,,,unknown,20000,5/1/2010,7/2/1905,2010-Q2,/company/smackages,http://www.smackages.com
Dragonfly List,web,Find local talented freelancers,"recruitment, freelancers, creative-agency, staffing, human-resources, talent",3/22/2012,AUS,,Melbourne,20000,2/1/2012,7/4/1905,2012-Q1,/company/dragonfly-list,http://dragonflylist.com
Skillbridge,web,Marketplace for Freelance Work,"sales, marketing, consulting",,,,unknown,20000,7/25/2013,7/5/1905,2013-Q3,/company/skillbridge,http://skillbridge.co
APROOFED,education,College Writer Editor Marketplace,"writer, editor, marketplace, online, freelance, student, college",2/1/2013,USA,OH,Cleveland,20000,6/1/2013,7/5/1905,2013-Q2,/company/aproofed-inc,http://www.aproofed.com
Diavibe,other,Drug-free topical anesthetic solutions,"medical-device, drug-free, betaspring",1/1/2010,USA,RI,Providence,20000,6/1/2010,7/2/1905,2010-Q2,/company/diavibe,http://www.diavibe.com
OrangeSlyce,web,freelance project finder,"students, internships, jobs, freelance-projects, small-businesses, asu",1/1/2009,USA,AZ,Phoenix,12000,6/1/2010,7/2/1905,2010-Q2,/company/orangeslyce,http://www.orangeslyce.com
Mogotest,software,,"web-testing, web-design, cross-browser, rendering, cloud, verification, validation, techstars, techstars-boston-2010",12/1/2009,USA,MA,Boston,12000,3/1/2010,7/2/1905,2010-Q1,/company/mogotest,http://mogotest.com
Auto Mute,software,Makes your computer silent by defult,"software, shareware, free, freeware, windows, mac-os-x, karpolan",10/31/2009,UKR,,Kiev,10000,10/15/2012,7/4/1905,2012-Q4,/company/auto-mute,http://auto-mute.com
Adhysteria,web,,"video-classifieds, video-auctions, free-classifieds, video-sharing",9/1/2007,IND,,Mumbai,10000,7/1/2007,6/29/1905,2007-Q3,/company/adhysteria,http://www.adhysteria.com
37signals,public_relations,Frustration-free web-based apps,"project-management, 37signals, basecamp, highrise, campfire, backpack, social, chicago, tadalist, saas",1/1/1999,USA,IL,Chicago,0,7/1/2006,6/28/1905,2006-Q3,/company/37signals,http://37signals.com
webme,network_hosting,free website builder,"page-builder, page-creator, site-builder, site-creator, website-builder, website-creator, homepage-baukasten, websitecreator, sitecreator, ajax, sitebuilder, website",9/1/2007,DEU,,Erlangen,0,1/1/2008,6/30/1905,2008-Q1,/company/own-free-website,http://www.own-free-website.com
Vital Juice,web,Free daily health newsletter,,,USA,NY,New York,0,1/29/2009,7/1/1905,2009-Q1,/company/vital-juice,http://www.vitaljuice.com
Badongo.com,network_hosting,Free File Hosting,"file-sharing, backup, file-storage, storage, share, image-hosting",1/1/2005,USA,CA,Los Angeles,0,1/1/2006,6/28/1905,2006-Q1,/company/badongo-com,http://www.badongo.com
North by South,software,Open source near-shoring,"latin-america, open-source, free-software, social-applications, web-applications, user-acquisition, linux, drupal, joomla, sugarcrm, freebsd, near-shoring, brazil, sao-paulo, migration, government",1/1/2007,USA,CA,SF Bay,0,5/1/2008,6/30/1905,2008-Q2,/company/north-by-south,http://www.northxsouth.com
SocialDeck,games_video,Mobile social gaming company.,"mobile, social, gaming, casual-games, games, iphone, blackberry, cross-platform, viral",1/1/2008,CAN,,Waterloo,0,8/20/2009,7/1/1905,2009-Q3,/company/socialdeck,http://socialdeck.com
HourVille,games_video,Hourly marketplace,"local-services, rentals, classes, places, spaces, hourly, local, services, babysitter, lessons, tutors, tutoring, massage, entertainment, search, local-search, dog-walking, house-sitting, teaching, personal-training, web-2-0, b2c, austin, texas, tx, freel",1/1/2008,USA,TX,Austin,0,8/1/2009,7/1/1905,2009-Q3,/company/hourville,http://www.hourville.com
SMITH (formerly Ascentium),design,Digital Experience Agency ,"interactive-marketing, consultancy, sharepoint, moss, seo, sem, analytics, social-media",1/1/2001,USA,WA,Seattle,0,8/5/2009,7/1/1905,2009-Q3,/company/ascentium,http://www.smith.co
OpenHatch,other,Open source software involvement engine ,open-source-community,5/1/2009,,,unknown,0,,,,/company/openhatch,http://openhatch.org
iBloom Technologies,web,Blooming Tech Ideas!,"expert-help, expert-advice, free-advice, free-help, personalized-help, live-help-now, live-advice, expert-consultation, expert-meetings, live-qa-feeds, qa-feeds, qa-search-engine, answer-engine, answer-search-engine, answer-search-aggregator",5/1/2009,IND,,Ahmedabad,0,5/1/2009,7/1/1905,2009-Q2,/company/ibloom-technologies,http://www.HelloExpert.com
Shop Airlines,ecommerce,Crossboarder Buying Concierge eCommerce,"japan, ecommerce, global, international, ebay, tokyo",4/19/2007,JPN,,Tokyo,0,9/16/2009,7/1/1905,2009-Q3,/company/shop-airlines,http://www.sekaimon.com
E-Generator,ecommerce,Freelancer website,,1/1/2005,,,unknown,0,1/1/2005,6/27/1905,2005-Q1,/company/e-generator,http://www.e-generator.ru
joiz,games_video,social TV HD Channel,"social-tv, cross-media, second-screen, tv, web, mobile, social-media, zurich, switzerland",8/3/2009,CHE,,Zurich,0,1/1/2010,7/2/1905,2010-Q1,/company/joiz,http://www.joiz.ch
Jigsee,mobile,streaming platform for emerging markets,"emerging-markets, mobile-video, mobile-streaming, feature-phones, mobile-advertising, mobile-video-advertising, freemium-content, india, bric, youtube, snaptu, hulu",4/17/2008,IND,,Santa Cruz,0,2/14/2011,7/3/1905,2011-Q1,/company/jigsee,http://www.jigsee.com
