company_name,company_category,description,tag_list,founded_at,country,state,region,funding_total_usd,funded_at,funded_year,funded_quarter,cb_url,homepage_url
Bigpoint,games_video,developer and provider of online games,"online-games, browser-games, browsergames, browser-based-online-games, free-to-play, game-portal, publisher, content-provider, developer, games, mmo, mmog",1/1/2002,DEU,,Hamburg,460488000,6/9/2008,6/30/1905,2008-Q2,/company/bigpoint,http://www.bigpoint.com
Fotolia,advertising,Royalty-free stock photography,"stockphotos, digitalimages, microstockhouses, photos",1/1/2005,USA,NY,New York,225000000,5/1/2009,7/1/1905,2009-Q2,/company/fotolia,http://us.fotolia.com
Celframe,software,Product Software Company,"office-suite, free-anti-virus, arun-pudur, security, software, erp, crm, mobile, tablet, os, alternative, free-av, download-manager, microsoft-office, windows, iphone, blackberry, android, live-chat, marketing, salesforce, accounting, contact-manager",10/9/1998,MYS,,Kuala Lumpur,173000000,2/19/2005,6/27/1905,2005-Q1,/company/celframe,http://www.celframe.com
Practice Fusion,health,"Free,Web-based Electronic Health Records","free-emr, free-ehr, certified-emr, certified-ehr, emr-certification, healthcare, health-care, healthcareit, health-care-it, emr, electronic-medical-records, ehr, electronic-health-records, phr, personal-health-records, physician, physicians, physician-sol",7/10/2005,USA,CA,SF Bay,140019998,1/6/2010,7/2/1905,2010-Q1,/company/practice-fusion,http://www.practicefusion.com/careers
Elance,web,Online Employment Platform,"talent, employment, outsource, hire, manage, pay, php-programmers, mysql-developers, online-employment-report, freelance, future-of-work",1/1/1998,USA,CA,SF Bay,94828397,2/1/2000,6/22/1905,2000-Q1,/company/elance,http://www.elance.com
Inside Secure.,software,open-standard contactless payment,,1/1/1995,FRA,,Aix en Provence,94734880,12/11/2007,6/29/1905,2007-Q4,/company/inside-secure-2,http://www.insidesecure.com
WildTangent,games_video,cross-device games company,"games, online-games, video-games, online-advertising",1/1/1998,USA,WA,Seattle,84000000,11/1/2007,6/29/1905,2007-Q4,/company/wildtangent,http://www.wildtangent.com/Corporate
OpenX,advertising,OpenX,"ad-server, ad-serving, ad-exchange, yield-optimization, content-valuation",5/1/2008,USA,CA,Los Angeles,75511200,6/1/2007,6/29/1905,2007-Q2,/company/openx,http://openx.com
Kaltura,software,Open Source Video Platform,"kaltura, video, collaborative, media, videowiki, wiki, mashup, open-source, video-platform, remix, video-editing, php, drupal, cms",10/1/2006,USA,NY,New York,69100000,5/1/2007,6/29/1905,2007-Q2,/company/kaltura,http://corp.kaltura.com
AlienVault,enterprise,"Unified Security Management, SIEM","ossim, siem, open-source, security, compliance, ids, ips, vulnerability-scanning, flows, pci, threat-detection, threat-intelligence, asset-discovery, behavioral-monitoring, vulnerability-assessment",3/7/2007,USA,CA,SF Bay,62900035,6/16/2010,7/2/1905,2010-Q2,/company/alienvault,http://www.alienvault.com
Talend,analytics,Open source integration software,,9/1/2005,USA,CA,SF Bay,61580000,7/16/2007,6/29/1905,2007-Q3,/company/talend,http://www.talend.com
Novariant,other,Precision machine control,location-and-machine-control-solutions-hands-free-steering-of-farm-machinery,1/1/1994,USA,CA,SF Bay,60500000,10/31/2008,6/30/1905,2008-Q4,/company/novariant,http://www.novariant.com
Proofpoint,software,Email Security and Data Loss,"email-security, email-archiving",6/1/2002,USA,CA,SF Bay,59000000,2/26/2008,6/30/1905,2008-Q1,/company/proofpoint,http://www.proofpoint.com
Eucalyptus Systems,enterprise,Open source private and hybrid clouds,"open-source, cloud-computing, hybrid-cloud, private-cloud, on-premise-cloud, infrastructure-as-a-service",1/1/2009,USA,CA,Santa Barbara,55500000,4/29/2009,7/1/1905,2009-Q2,/company/eucalyptus-systems-inc,http://www.eucalyptus.com
Orient Green Power,cleantech,renewable energy,"fossil-fuel, environment, renewable-energy",1/1/2007,SGP,,Chennai,55000000,11/26/2008,6/30/1905,2008-Q4,/company/orient-green-power,http://www.orientgreenpower.com/home.asp
Capella Photonics,network_hosting,Networks,"wavelength-selective-switch-wss, reconfigurable-optical-adddrop-multiplexers-roadm, optical-cross-connect-oxc",1/1/2000,USA,CA,SF Bay,52499595,3/15/2007,6/29/1905,2007-Q1,/company/capella,http://www.capellainc.com
Intune Networks,network_hosting,Telecom Equipment Design,"optical-burst-switching, opst, tunable-lasers, sub-wavelength, dynamic-networks, infinite-possiblities",1/1/1999,IRL,,Dublin,50250000,10/2/2009,7/1/1905,2009-Q4,/company/intune-networks,http://www.intunenetworks.com
Akorri Networks,software,cross-domain performance software,,1/1/2005,USA,MA,Boston,48730000,9/10/2007,6/29/1905,2007-Q3,/company/akorri,http://www.akorri.com
SpiralFrog,games_video,,"zucchero, music, free",1/1/2004,USA,NY,New York,45000000,1/1/2007,6/29/1905,2007-Q1,/company/spiralfrog,http://www.spiralfrog.com
IP Commerce,network_hosting,Open commerce network,"commerce, network, software",1/1/2005,USA,CO,Denver,44028672,4/1/2008,6/30/1905,2008-Q2,/company/ip-commerce,http://www.ipcommerce.com
oDesk,web,Online workplace,"online-work, hiring, employment, staffing, jobs, freelancing, remote-work, virtual-work, crowdsourcing",1/1/2005,USA,CA,SF Bay,44000000,4/25/2006,6/28/1905,2006-Q2,/company/odesk,https://www.odesk.com
RingCentral,messaging,phone system integration ,"business-phone-service, voip, phone, toll-free-numbers, 800-numbers, internet-fax, office, mobile",1/1/2003,USA,CA,SF Bay,44000000,9/1/2007,6/29/1905,2007-Q3,/company/ringcentral,http://www.ringcentral.com
Jaspersoft,software,open source business software,"business-intelligence, reporting, dashboards, analytics, open-source",1/1/2001,USA,CA,SF Bay,43500000,12/10/2008,6/30/1905,2008-Q4,/company/jaspersoft,http://www.jaspersoft.com
MySQL,enterprise,Opensource Database Solution,"database, opensource, lamp, databaseserver",,USA,CA,SF Bay,40800000,2/1/2006,6/28/1905,2006-Q1,/company/mysql,http://www.mysql.com
UniversityNow,education,Education & Technology Venture,"education, technology, college, freemium, consumer",1/1/2010,USA,CA,SF Bay,40500000,6/21/2012,7/4/1905,2012-Q2,/company/universitynow,http://www.unow.com
Zango,games_video,,"games, videos, downloads, free, adware",1/1/1999,USA,WA,Seattle,40000000,3/1/2004,6/26/1905,2004-Q1,/company/zango,http://zango.com
MyBuys,advertising,Cross-Channel Personalization,"personalization, mobile, social, recommendations, email, ads, remarketing, display, media",1/1/2006,USA,CA,SF Bay,38300000,2/21/2007,6/29/1905,2007-Q1,/company/mybuys,http://www.mybuys.com
Vindicia,analytics,SaaS Marketing & Billing,"marketing, crm, billing, saas-billing, marketing-automation, freemium, subscriptions-billing, subscription-billing, recurring-billing, billing-system, billing-solutions, billing-software, saas, online-business-models, saas-marketing, fraud-management, cha",1/1/2003,USA,CA,SF Bay,37600000,3/31/2008,6/30/1905,2008-Q1,/company/vindicia,http://www.vindicia.com
Platform Solutions,hardware,Open Mainframe computers,,1/1/1999,USA,CA,SF Bay,37000000,11/27/2007,6/29/1905,2007-Q4,/company/platform-solutions,http://www.platformsolutions.com
StyleTread,fashion,,"shoes, online, footwear, free-delivery, styles, sizes, australia",11/9/2010,AUS,,Sydney Olympic Park,36450000,3/28/2012,7/4/1905,2012-Q1,/company/styletread,http://www.styletread.com.au
Laszlo Systems,messaging,Web and mobile user experience solutions,"unified-communications, applications, web, mobile, user-experience, cross-applications, cross-devices, social, android, communications",1/1/2000,USA,CA,SF Bay,36390000,3/6/2008,6/30/1905,2008-Q1,/company/laszlosystems,http://www.laszlosystems.com
StrongView,enterprise,email and cross-channel marketing,"cross-channel-marketing, moblie-marketing, email-marketing, esp, social-media, display, retargeting, saas, on-premise",1/1/2002,USA,CA,SF Bay,36100000,7/13/2009,7/1/1905,2009-Q3,/company/strongmail,http://www.strongview.com
BlueCava,advertising,Cross-Screen Marketing,"device-identification, online-advertising, targeted-advertising, fraud, risk",1/1/2010,USA,CA,Los Angeles,31257259,10/21/2011,7/3/1905,2011-Q4,/company/bluecava,http://www.bluecava.com
Symbian Foundation,mobile,Open Source Mobile OS,mobile-platforms,6/24/2008,GBR,,London,30839600,11/2/2010,7/2/1905,2010-Q4,/company/symbian,http://www.symbian.org
fring Ltd,mobile,VoIP Solutions for Carriers & Enterprise,"mvoip, voip, mobile, skype, google-talk, msn, messenger, im, free-mobile-calls, free, wifi, 3g, sip, twitter, icq, aim, yahoo, add-on, api, open-api, facebook, orkut, gmail",5/10/2006,,,unknown,30000000,8/1/2007,6/29/1905,2007-Q3,/company/fring,http://www.fring.com
Guvera,games_video,Advertiser-supported free content site,"branded-entertainment, free-content",1/1/2008,AUS,,Australia - Other,30000000,1/1/2008,6/30/1905,2008-Q1,/company/guvera,https://www.guvera.com
Flock,web,free social web browser,"webbrowser, mozilla, social, browser, platform, innovative, transformative, disruptive, dynamic",1/1/2005,USA,CA,SF Bay,28300000,1/1/2005,6/27/1905,2005-Q1,/company/flock,http://flock.com
Netbiscuits,mobile,Mobile Web Development Platform,"mobile-web, cloud-platform, adaptive-web-technology, responsive-design, mobile-web-solutions, cloud-solutions, mobile-development, cross-platfrom, html5, css, web-development",1/1/2000,DEU,,Kaiserslautern,27000000,1/1/2007,6/29/1905,2007-Q1,/company/netbiscuits,http://www.netbiscuits.com
Boxee,software,Open source social media,"tv, tv-media",1/1/2004,ISR,,Tel Aviv,26500000,11/18/2008,6/30/1905,2008-Q4,/company/boxee,http://www.boxee.tv
Flat World Knowledge,software,Open College Textbooks,"books, free-books, online-books, college",1/1/2007,USA,NY,Irvington,26200000,3/24/2009,7/1/1905,2009-Q1,/company/flat-world-knowledge,http://www.flatworldknowledge.com
Nimbuzz,mobile,"Mobile messaging, VoIP and Social","messaging-app, calling-app, instant-messaging, social-networks, im, messaging, voip, file-sending, chat, free, mobile, mobile-voip, sip, mih, mangrove",5/5/2006,NLD,,Capelle a/d IJssel,25000000,6/1/2007,6/29/1905,2007-Q2,/company/nimbuzz,http://www.nimbuzz.com
Yola,web,Free Websites,"website-creator, site-creator, small-business, sitebuilder, website, synthasite, silicon-cape, siliconcape",3/1/2007,USA,CA,SF Bay,25000000,11/1/2007,6/29/1905,2007-Q4,/company/yola,http://www.yola.com
Wave Accounting,software,finance tools for small biz,"accounting, online, saas, free, small-business, freelancer, cloud, application, software, payroll, mobile, invoicing, checks, cheques, receipts, personal-accounting, web-apps, tools",11/16/2010,CAN,,Toronto,24557478,5/15/2011,7/3/1905,2011-Q2,/company/wave-accounting,http://www.waveapps.com
OpenGamma,software,Open Source Risk Platform,"financial-services, open-source",8/1/2009,GBR,,London,23150000,8/1/2009,7/1/1905,2009-Q3,/company/opengamma,http://www.opengamma.com
SnagFilms,social,Free Movies On Demand,"online-streaming, movies, online-video, ad-supported, video-platform, entertainment, film, apps, documentary, video, watch-movies, watch-free-movies, stream-movies",7/15/2008,USA,DC,Washington DC,23000000,1/16/2011,7/3/1905,2011-Q1,/company/snagfilms,http://snagfilms.com
Integrate,software,Marketing Software and Media Services,"marketing-technology, marketing-software, media-services, performance-marketing, cross-channel-marketing",4/1/2010,USA,AZ,Phoenix,22250000,12/14/2010,7/2/1905,2010-Q4,/company/integrate,http://integrate.com
ForgeRock,enterprise,Open source identity middleware,,2/1/2010,NOR,,Lysaker,22000000,3/2/2012,7/4/1905,2012-Q1,/company/forgerock,http://www.forgerock.com
Virtual Computer,software,Data loss prevention,"client-side-vdi, idv, intelligent-desktop-virtualization, desktop-virtualization, vdi, virtual-desktop-infrastructure, nxtop, lenovo, intel",1/1/2007,USA,MA,Boston,21000000,1/26/2009,7/1/1905,2009-Q1,/company/virtual-computer,http://www.virtualcomputer.com
Chartboost,games_video,Technology platform for games,"iphone, ios, app-store, apps, games, gaming, advertising, monetization, cross-promotion",2/1/2011,USA,CA,SF Bay,21000000,10/1/2011,7/3/1905,2011-Q4,/company/chartboost,http://www.chartboost.com
LimeLife,news,Cross-platform digital media for women,,6/1/2004,USA,CA,SF Bay,20900000,3/28/2006,6/28/1905,2006-Q1,/company/limelife,http://www.limelife.com
Vericept,software,compliance and data loss software,,1/1/1999,USA,CO,Denver,20500000,7/15/2008,6/30/1905,2008-Q3,/company/vericept,http://www.vericept.com
Drawbridge,advertising,Cross device advertising,"mobile, advertising, targeting, cross-device",11/1/2010,USA,CA,SF Bay,20500000,5/11/2012,7/4/1905,2012-Q2,/company/drawbridge,http://drawbrid.ge
Vontu,software,data loss prevention software,,1/1/2001,USA,CA,SF Bay,20000000,8/11/2006,6/28/1905,2006-Q3,/company/vontu,http://www.vontu.com
Fiverr.com,web,Buy. Sell. Have fun.,"fiverr, fiver, fiverr-com, gig, marketplace, task, service, outsource, outsourcing, freelance, freelancing, moonlight, moonlighting, virtual-assistance, new-entrepreneur, gig-economy, micro-entrepreneur, service-marketplace, collaborative-consumption",2/1/2010,ISR,,Tel Aviv,20000000,1/1/2011,7/3/1905,2011-Q1,/company/fiverr,http://www.fiverr.com
Udacity,education,Free Online University Classes,online-education,1/1/2011,USA,CA,SF Bay,20000000,1/1/2012,7/4/1905,2012-Q1,/company/udacity,http://www.udacity.com
Mirantis,enterprise,OpenStack Solutions Company,"openstack, it-infrastructure, open-source, open-cloud, cloud-computing",9/1/1999,USA,CA,SF Bay,20000000,1/10/2013,7/5/1905,2013-Q1,/company/mirantis,http://www.mirantis.com
Gengo,web,Communicate freely,"translation-services, english, japanese, crowdsourcing, human-translation",12/18/2008,JPN,,Tokyo,18800000,8/1/2010,7/2/1905,2010-Q3,/company/gengo,http://gengo.com
7digital,music,Digital Media Delivery,"drm-free, online-music, universal, warner-music-group",1/1/2004,GBR,,London,18500000,1/1/2008,6/30/1905,2008-Q1,/company/7digital,http://www.7digital.com/business
Quick Hit,sports,"free, social sports games",,4/1/2008,USA,MA,Foxboro,18500000,1/14/2009,7/1/1905,2009-Q1,/company/quick-hit,http://quickhit.com
Palamida,security,App. Security for Open Source Software,,1/1/2003,USA,CA,SF Bay,18500000,2/15/2005,6/27/1905,2005-Q1,/company/palamida,http://www.palamida.com
Openbravo,software,Open Source ERP,"open-source, erp, pos",1/19/2006,ESP,,Pamplona,18034000,4/16/2008,6/30/1905,2008-Q2,/company/openbravo,http://www.openbravo.com
Peak Games,games_video,,"social-gaming, games, facebook-games, mobile-gaming, free-to-play-gaming",11/19/2010,TUR,,Turkey - Other,18000000,5/25/2011,7/3/1905,2011-Q2,/company/peak-games,http://www.peakgames.net
MyFitnessPal,web,The leading free resource to take charge,"health, wellness, weight-management, weight-loss, diet, fitness, social-network, community, nutrition, calories, exercise",1/1/2005,USA,CA,SF Bay,18000000,8/13/2013,7/5/1905,2013-Q3,/company/myfitnesspal,http://myfitnesspal.com
GameDuell,games_video,Casual Online Games,"games, social, cross-platform, berlin, fun, good-time, community",12/1/2003,USA,CA,SF Bay,17450000,7/3/2008,6/30/1905,2008-Q3,/company/gameduell,http://www.gameduell.com
Boom Financial,finance,Cross Border Mobile Banking,,1/1/2008,USA,CA,SF Bay,17000000,7/1/2008,6/30/1905,2008-Q3,/company/m-via,http://useboom.com
FreedomPop,mobile,Wireless Internet Provider,"broadband-disruption, broadband-internet, internet-service-provider, mvno, photon, freedom-sleeve-rocket, review, hub-burst",1/1/2011,USA,CA,Los Angeles,16800000,7/10/2012,7/4/1905,2012-Q3,/company/freedompop,http://freedompop.com
OMGPOP,games_video,Free online multiplayer game ,"dating, gaming, auction",1/1/2006,USA,NY,New York,16600000,5/1/2007,6/29/1905,2007-Q2,/company/omgpop,http://omgpop.com
Goom Radio,web,Internet radio,"music, live-radio, marketing, audio-branding, ad-supported-music, internet-radio, interactive, digital, audio-advertising, mobile, iphone, blackberry, application, free-app, music-discovery, live-events, on-air-personalities",3/17/2009,USA,NJ,New York,16000000,4/14/2009,7/1/1905,2009-Q2,/company/goom-radio,http://www.goomradio.fr
Reconnex,software,,"data-loss, data-leak, data-protection, content-monitoring, content-filtering, security, appliance",,USA,CA,SF Bay,16000000,4/30/2006,6/28/1905,2006-Q2,/company/reconnex,http://www.reconnex.net
SmartRecruiters,software,The Free Hiring Platform,"recruiting-software, hiring-software, hiring-platform, marketplace-for-recruiting-services, recruitment-software, recruiting, recruitment",9/1/2010,USA,CA,SF Bay,15460000,1/9/2012,7/4/1905,2012-Q1,/company/smartrecruiters,http://www.smartrecruiters.com
Visual IQ,software,,"marketing-attribution, marketing-software, attribution-management, cross-channel-marketing",1/1/2006,USA,MA,Boston,15000000,8/20/2010,7/2/1905,2010-Q3,/company/visual-iq,http://www.visualiq.com
MasterImage 3D,hardware,3D Cinema & Glasses-Free Mobile Display,"3d, 3d-movies, 3d-mobile, 3d-display, 3d-tablets, 3d-smartphones, 3d-content",1/1/2004,USA,CA,Los Angeles,15000000,3/22/2011,7/3/1905,2011-Q1,/company/masterimage-3d,http://masterimage3d.com
SigFig,finance,Free online investment advice,"investing, investment-advice, portfolio-tracking, portfolio-management-software",1/1/2011,USA,CA,SF Bay,15000000,7/2/2013,7/5/1905,2013-Q3,/company/sigfig,http://sigfig.com
BodyMedia,health,Innovative body monitoring devices,diet-gadgets-weight-loss-diet-device,1/1/1999,USA,PA,Pittsburg,14727154,5/23/2012,7/4/1905,2012-Q2,/company/bodymedia,http://www.bodymedia.com
Wavemaker Software,software,Open source web development tools,"open-source, web-development, visual-web-software",,USA,CA,SF Bay,14500000,4/15/2008,6/30/1905,2008-Q2,/company/wavemaker-software,http://www.wavemaker.com
Challenge Games,network_hosting,Online social games,"social-games, facebook-games, role-playing-game, social-network, turn-based-game, fantasy-sports, trading-card-game, baseball, free-to-play, online-game, rpg, ccg, tcg, mmo, football-games",1/1/2006,USA,TX,Austin,14500000,7/10/2008,6/30/1905,2008-Q3,/company/challenge-games,http://www.challengegames.com
BA Insight,software,SharePoint/FAST Search,"enterprise-search, sharepoint, fast, moss, microsoft",1/1/2004,USA,NY,New York,14500000,9/20/2010,7/2/1905,2010-Q3,/company/ba-insight,http://www.BAinsight.com
WhiteFence,other,Free survice,"free-service, phone, internet, television, electricity, natural-gas",1/1/2000,USA,TX,Houston,14000000,3/15/2007,6/29/1905,2007-Q1,/company/whitefence,http://www.whitefence.com
Piston Cloud Computing,enterprise,The Enterprise OpenStack Company,"cloud-computing, openstack, private-cloud, open-source, iaas",1/1/2011,USA,CA,SF Bay,14000000,6/21/2011,7/3/1905,2011-Q2,/company/piston-cloud-computing,http://www.pistoncloud.com
AppGratis,mobile,1 free app a day,"app-discovery, free-app-a-day, daily-deals, app-deals, app-store",1/1/2010,FRA,,Paris,13500000,1/1/2013,7/5/1905,2013-Q1,/company/appgratis,http://appgratis.com
"Machine Zone, Inc.",games_video,Mobile F2P Tech Platform & MMO Games,"free2play, free-to-play, f2p, mmo, mobile-games, online-games, social-gaming, translation, chat",1/1/2008,USA,CA,SF Bay,13300000,1/1/2012,7/4/1905,2012-Q1,/company/machine-zone,http://www.machinezone.com
Grand Cru,games_video,Developer of free to play iOS games,games-mobile-mobile-games-social-social-games-mmo-browser-games-synchronous-multiplayer-user-generated-content,1/1/2011,FIN,,Helsinki,13000000,5/6/2011,7/3/1905,2011-Q2,/company/grand-cru,http://grandcrugames.com
Agilence,enterprise,Retail Loss Prevention Software,"security, payment, anti-fraud",1/1/2006,USA,NJ,Philadelphia,12727468,11/18/2008,6/30/1905,2008-Q4,/company/agilence,http://agilenceinc.com
Webs,web,Create Website for Free!,"freewebs, webs, social-publishing, social-websites, free-websites, website-creator",6/1/2001,USA,MD,Washington DC,12000000,2/9/1998,6/20/1905,1998-Q1,/company/freewebs,http://www.webs.com
Medsphere Systems,software,open-source software for healthcare,,1/1/2002,USA,CA,San Diego,12000000,8/31/2009,7/1/1905,2009-Q3,/company/medsphere-systems,http://www.medsphere.com
Game Closure,games_video,Multiplayer Game Developer,"games, sdk, multiplayer-games, cross-platform-games, html5",1/1/2011,USA,CA,SF Bay,12000000,8/31/2011,7/3/1905,2011-Q3,/company/game-closure,http://www.gameclosure.com
Listia,web,Give & Get Free Stuff,"ebay, auctions, listings, free, craigslist, credits, wehavestandards",8/1/2009,USA,CA,SF Bay,11165000,6/1/2009,7/1/1905,2009-Q2,/company/listia,http://www.listia.com
Planet Soho,web,Business Management Platform,"small-businesses, saas, cloud-based, freelancers, micro-businesses, business-management, entrepreneurs, management-solution, social-networking-tools, business-leads, cost-effective, collaboration, soho",1/1/2009,USA,CA,SF Bay,11000000,7/1/2010,7/2/1905,2010-Q3,/company/planet-soho,http://www.PlanetSoho.com
eyeSight Mobile Technologies,software,Gesture Recognition technology,"geature-recognition, touch-free, motion-control, hand-gestures, software",1/1/2005,ISR,,Herzeliya,10900000,11/22/2011,7/3/1905,2011-Q4,/company/eyesight-mobile-technologies,http://www.eyeSight-tech.com
Optify,software,Digital Marketing Software,"b2b-marketing, lead-generation, twitter-for-business, tracking-twitter, free-marketing-software, seo, search-engine-optimization, seo-software, lead-intelligence, inbound-marketing, demand-generation-software",8/8/2008,USA,WA,Seattle,10849999,10/10/2008,6/30/1905,2008-Q4,/company/optify,http://www.optify.net
Retrofit,health,Data-driven weight loss,"health, weight-loss",,USA,IL,Chicago,10700000,3/15/2012,7/4/1905,2012-Q1,/company/retrofit,http://www.retrofitme.com
VoltDB,analytics,Open-Source DBMS,"dbms, nosql, big-data, newsql",4/1/2009,USA,MA,Boston,10590000,9/7/2010,7/2/1905,2010-Q3,/company/voltdb,http://voltdb.com
PeoplePerHour.com,web,freelance marketplace ,"freelance, outsource, employment, hire, manage",9/14/2007,GBR,,London,10518676,2/14/2010,7/2/1905,2010-Q1,/company/people-per-hour,http://www.peopleperhour.com
Video Blocks,games_video,Stock Video and Audio,"stock-video, stock-footage, production-music, sound-effects, after-effects, motion-backgrounds, royalty-free-media, stock-music, video-editing, video, video-production",1/1/2011,USA,VA,Washington DC,10500000,9/6/2012,7/4/1905,2012-Q3,/company/video-blocks,http://www.videoblocks.com
Palringo,messaging,instant messaging program,"voice, media, instant-messaging, mobile, iphone, application, group-messaging, push-to-talk, social-groups, community, voice-chat, group-chat, picture-messaging, text-messaging, cross-platform, mobile-devices",1/1/2006,GBR,,Cramlington,10278515,8/1/2006,6/28/1905,2006-Q3,/company/palringo,http://www.palringo.com
Boonty,games_video,,"games, free-online-games, community, social-casual-gaming, casual-games, video-games, pc-games, items, play-4-free, advertising-games, boonty, cafe-com",3/1/2001,USA,NY,New York,10000000,7/7/2005,6/27/1905,2005-Q3,/company/boonty,http://www.boonty.net
Service2Media,mobile,,"mobile, app, platform, cross, multi, sap, sup, sybase, tablet, apps, applications, development, developers",1/1/2005,NLD,,Enschede,10000000,6/6/2011,7/3/1905,2011-Q2,/company/service2media,http://www.service2media.com
Testin,mobile,Cross Platform Automated App Testing,"mobile, testing, cloud-testing, automated-testing, cross-platform, saas, android, ios, qa",1/1/2011,HKG,,Hong Kong,10000000,1/11/2011,7/3/1905,2011-Q1,/company/testin,http://www.itestin.com
Comprehend Systems,enterprise,Cross-datasource analytics,"saas, cloud-analytics, big-data, clinical-reporting, data-analysis, platform, drug-trials",1/1/2010,USA,CA,SF Bay,9600000,11/8/2011,7/3/1905,2011-Q4,/company/comprehend-systems,http://www.comprehend.com
DeliRadio Concert Network,music,Streaming Radio for Concert Discovery,"streaming, radio, music, concerts, free, venues, festivals, local, events, artists, tickets, mobile, discovery, analytics, branded",1/1/2011,USA,CA,SF Bay,9350000,10/8/2013,7/5/1905,2013-Q4,/company/deliradio-concert-network,http://deliradio.com
DevZuz,enterprise,Open Source Delivery Platform,,,USA,,TBD,9250000,4/30/2007,6/29/1905,2007-Q2,/company/devzuz,http://www.devzuz.com
BookShout!,software,Open ecosystem e-reading platform,,2/1/2011,USA,TX,Dallas,8750000,4/25/2013,7/5/1905,2013-Q2,/company/bookshout,http://www.bookshout.com
ClearFit,web,App that fixes hiring.,"employee-retention, job-description-template, interview-questions-and-answers, job-openings, employee-screening, employee-assessment, employee-hiring, hiring-tool, finding-employees, free-career-assessment, hiring-solution, find-employees, hiring-help, hi",10/1/2007,USA,CA,SF Bay,8665000,1/1/2012,7/4/1905,2012-Q1,/company/clearfit,http://clearfit.com
netTALK,hardware,Telephony Systems,"free-local-and-long-distance-calling, more-talk-no-bills",9/8/2008,USA,,United States - Other,8600000,10/1/2009,7/1/1905,2009-Q4,/company/nettalk,http://www.nettalk.com
DramaFever,games_video,Best of international TV and movies,"video, streaming, freemium, asian, tv, vod, prime-time, drama",8/6/2009,USA,NY,New York,8500000,6/12/2012,7/4/1905,2012-Q2,/company/dramafever,http://www.dramafever.com
Generate,games_video,Cross platform production & management,"video, professional, cross-platform, entertainment, tv, production, talent-management, research, millennials",1/1/2004,USA,CA,Los Angeles,8000000,3/4/2008,6/30/1905,2008-Q1,/company/generate,http://www.generatela.com
Engrade,education,Free Online Gradebook,"education, gradebook, lms, teaching, teachers, school, college, university, learning",1/1/2003,USA,CA,Los Angeles,8000000,5/2/2012,7/4/1905,2012-Q2,/company/engrade,http://www.engrade.com
Crushpath,advertising,Free Marketing Platform,,4/1/2011,USA,CA,SF Bay,8000000,6/19/2012,7/4/1905,2012-Q2,/company/crushpath,http://www.crushpath.com
